Drug Name,Review Text,cleaned_comments,side_effects
qelbree,"Tapering off qelbree. Advice?  I cross-tapered in the opposite direction. Tapered down off Strattera while tapering up onto Qelbree. That's when I learned about the debilitating migraine.  It only lasted a full day, but the brutality of it kept me fully out of action. Now, the thought of ever coming off or going on a lengthy trip and coming up short is terrifying. I guess ""that's how they get you."" 😞",tapering off qelbree advice  i cross tapered in the opposite direction tapered down off strattera while tapering up onto qelbree thats when i learned about the debilitating migraine  it only lasted a full day but the brutality of it kept me fully out of action now the thought of ever coming off or going on a lengthy trip and coming up short is terrifying i guess thats how they get you,[]
qelbree,Tapering off qelbree. Advice?  and the coupon doesnt work well? it cut the cost in half when mine didnt cover it (which is still stupid expensive)  as for taper i dont know because i too ended up in the ER and immediately went back on them.,tapering off qelbree advice  and the coupon doesnt work well it cut the cost in half when mine didnt cover it which is still stupid expensive  as for taper i dont know because i too ended up in the er and immediately went back on them,[]
qelbree,"Tapering off qelbree. Advice?  My doc put me on super low dose strattera to help taper off qelbree. It worked perfectly. 

I was on 200mg qelbree and started taking that every other day and 18mg strattera the other days. Then after a couple weeks I stretched it to two strattera then 1 qelbree. And when that was ok I went 3 days then forgot I had 1 qelbree left and took it last night. Basically tapered over a full month plus a bit. No problems at all. 

My ins never covered it and they majorly changed the coupon so it’s useless for people without insurance now unless they have $200/month laying around.","tapering off qelbree advice  my doc put me on super low dose strattera to help taper off qelbree it worked perfectly 

i was on mg qelbree and started taking that every other day and mg strattera the other days then after a couple weeks i stretched it to two strattera then  qelbree and when that was ok i went  days then forgot i had  qelbree left and took it last night basically tapered over a full month plus a bit no problems at all 

my ins never covered it and they majorly changed the coupon so its useless for people without insurance now unless they have month laying around",[]
qelbree,"Tapering off qelbree. Advice?  I tapered off of 100s over a month by opening the capsules and doing my best to divide the little dots into half and quarters.  I had a low grade migraine 2 days after taking my last dose of the quarter amount.  It only lasted about a half day.
Before tapering off though, I found that taking a Nurtec (a prescribed migraine medication) really helped.","tapering off qelbree advice  i tapered off of s over a month by opening the capsules and doing my best to divide the little dots into half and quarters  i had a low grade migraine  days after taking my last dose of the quarter amount  it only lasted about a half day
before tapering off though i found that taking a nurtec a prescribed migraine medication really helped",[]
qelbree,Tapering off qelbree. Advice?  I missed two doses because of the pharmacy not getting it in time and I ended up in urgent care desperate for relief from the horrible migraine. It was terrible.,tapering off qelbree advice  i missed two doses because of the pharmacy not getting it in time and i ended up in urgent care desperate for relief from the horrible migraine it was terrible,[]
qelbree,"Qelbree and caffeine? Qelbree interferes with your body’s processes that break down caffeine. Therefore whatever effects it has on you will last much, much longer. Keep this well in mind.",qelbree and caffeine qelbree interferes with your bodys processes that break down caffeine therefore whatever effects it has on you will last much much longer keep this well in mind,[]
qelbree,"Qelbree and caffeine? It will amp up some people’s heart rate, blood pressure and anxiety level.",qelbree and caffeine it will amp up some peoples heart rate blood pressure and anxiety level,[]
qelbree,"Qelbree and caffeine? Before starting any meds, I normally consumed half a pot of richly brewed coffee a day with no ill consequences. 

When I first started on Qelbree, I was having manic episodes (absolutely not normal for me) and severe insomnia for the first two weeks.  After reading about the caffeine interaction, I cut out coffee entirely and those side effects went away and I was able to sleep through the night again. 

Remarkably I had no withdrawal issues from cold turkey-ing caffeine either. 

I'll have a small cup of coffee on the weekend now, 3 months later, because I love it so much, but I can tell I shouldn't drink more as my heartbeat gets irregular. 

From what I've read your ability to process caffeine and melatonin slows down to about 25% of normal depending on the individual.","qelbree and caffeine before starting any meds i normally consumed half a pot of richly brewed coffee a day with no ill consequences 

when i first started on qelbree i was having manic episodes absolutely not normal for me and severe insomnia for the first two weeks  after reading about the caffeine interaction i cut out coffee entirely and those side effects went away and i was able to sleep through the night again 

remarkably i had no withdrawal issues from cold turkey ing caffeine either 

ill have a small cup of coffee on the weekend now  months later because i love it so much but i can tell i shouldnt drink more as my heartbeat gets irregular 

from what ive read your ability to process caffeine and melatonin slows down to about  of normal depending on the individual",[]
qelbree,"Qelbree and caffeine? It slows down your bodies ability to process caffeine. Significantly. So a coffee in the afternoon and you’re basically fucked for sleep lol. I used it as a chance to significantly reduce my coffee intake and will work to probably do decaf or none in the foreseeable future. I used to have 2 coffees a day and now I have 1 but I also don’t feel the need for the coffee as I can control my focus much better on this med. I drink way less alcohol too, again less desire, but I feel like super shit drinking alcohol on this. 

I do still enjoy marijuana edibles a few times a week with no noticeable issue.","qelbree and caffeine it slows down your bodies ability to process caffeine significantly so a coffee in the afternoon and youre basically fucked for sleep lol i used it as a chance to significantly reduce my coffee intake and will work to probably do decaf or none in the foreseeable future i used to have  coffees a day and now i have  but i also dont feel the need for the coffee as i can control my focus much better on this med i drink way less alcohol too again less desire but i feel like super shit drinking alcohol on this 

i do still enjoy marijuana edibles a few times a week with no noticeable issue",[]
qelbree,"Qelbree and caffeine? I drink 1-3 cups of green tea per day, I brew it really light and space them out. Haven't noticed any negative effects and it seems to help focus me a little more, though I think it's a bit of the ritual of making tea and then settling down to study or start cleaning that gives me a boost when I make a cup. I would avoid large doses of caffeine at all costs, I drank an espresso like 1 month in and thought I was going to have a panic attack, I'd been a barista for years at that point and had NEVER had a caffeine reaction like that before.",qelbree and caffeine i drink   cups of green tea per day i brew it really light and space them out havent noticed any negative effects and it seems to help focus me a little more though i think its a bit of the ritual of making tea and then settling down to study or start cleaning that gives me a boost when i make a cup i would avoid large doses of caffeine at all costs i drank an espresso like  month in and thought i was going to have a panic attack id been a barista for years at that point and had never had a caffeine reaction like that before,[]
qelbree,"Qelbree and caffeine? Drinking coffee or other things with caffeine seems to cause nausea and headaches sometimes with me. Not sure about the other interactions they are talking about. The nausea and headaches are bad enough that I have been skipping caffeine… And I love coffee… It was really hard, but I really wanted to see results and the only other thing I could do would just be to stop Qelbree.",qelbree and caffeine drinking coffee or other things with caffeine seems to cause nausea and headaches sometimes with me not sure about the other interactions they are talking about the nausea and headaches are bad enough that i have been skipping caffeine and i love coffee it was really hard but i really wanted to see results and the only other thing i could do would just be to stop qelbree,[]
qelbree,"Qelbree and caffeine? I’ve been drinking it and feel fine. I have noticed that I don’t have the desire to drink multiple cups like I used to, now one a day will work for me and I actually much prefer that.",qelbree and caffeine ive been drinking it and feel fine i have noticed that i dont have the desire to drink multiple cups like i used to now one a day will work for me and i actually much prefer that,[]
qelbree,Qelbree and caffeine? My doctor told me it would make caffeine less efficient and avoided it initially. Then I needed some and it doesn’t seem to have any interaction at this point. I did wait until after the first few weeks and side effects had mostly gone away before trying.,qelbree and caffeine my doctor told me it would make caffeine less efficient and avoided it initially then i needed some and it doesnt seem to have any interaction at this point i did wait until after the first few weeks and side effects had mostly gone away before trying,[]
qelbree,Qelbree and caffeine? On 200mg caffeine made me sleepy asf,qelbree and caffeine on mg caffeine made me sleepy asf,[]
qelbree,"Qelbree and caffeine? I also heavily relied on caffeine before Qelbree! Somehow, it started causing caffeine to make me sleepy- so I had to just cut it out. Strangely, I had no caffeine withdrawal symptoms. I still drink at least one diet dr. pepper everyday because it doesn’t have very much caffeine, and i think the smaller dose gives me a little energy",qelbree and caffeine i also heavily relied on caffeine before qelbree somehow it started causing caffeine to make me sleepy  so i had to just cut it out strangely i had no caffeine withdrawal symptoms i still drink at least one diet dr pepper everyday because it doesnt have very much caffeine and i think the smaller dose gives me a little energy,[]
qelbree,"Qelbree and caffeine? When I tried strattera for 30 days, I had to cut caffeine significantly because it was affecting my sleep so bad. With Qelbree, I hadn't noticed the same effects with caffeine so I continued to drink my morning coffee as usual. But now after being on 400mg for 3-4 weeks, I am struggling to even finish my coffee and today I didn't even have the desire to drink one at all. Which I guess isn't a bad thing, it'll save me money lol but I also loved the routine and ritual of my morning cold brew.",qelbree and caffeine when i tried strattera for  days i had to cut caffeine significantly because it was affecting my sleep so bad with qelbree i hadnt noticed the same effects with caffeine so i continued to drink my morning coffee as usual but now after being on mg for   weeks i am struggling to even finish my coffee and today i didnt even have the desire to drink one at all which i guess isnt a bad thing itll save me money lol but i also loved the routine and ritual of my morning cold brew,[]
qelbree,"Qelbree and caffeine? I'm a daily cannabis smoker, I've seen no problems with that. Only caffeine. And on day 4 of Qelbree I had a single can of 8% hard cider and got WAY buzzed off of it and then had a horrible emotional plummet and had an entire meltdown that i couldn't control. Just so much sobbing out of nowhere. I had called a pharmacist and was told it wasn't dangerous to drink lightly, and being that it was my anniversary, I thought having one hard cider would be fine. Wrong 🫠",qelbree and caffeine im a daily cannabis smoker ive seen no problems with that only caffeine and on day  of qelbree i had a single can of  hard cider and got way buzzed off of it and then had a horrible emotional plummet and had an entire meltdown that i couldnt control just so much sobbing out of nowhere i had called a pharmacist and was told it wasnt dangerous to drink lightly and being that it was my anniversary i thought having one hard cider would be fine wrong,[]
qelbree,Qelbree and caffeine? Same here.  So very bazaro.,qelbree and caffeine same here  so very bazaro,[]
qelbree,Qelbree and caffeine? I did 12 days on Strattera and HATED it. I was so sick on it.,qelbree and caffeine i did  days on strattera and hated it i was so sick on it,[]
qelbree,"Qelbree and caffeine? It was a nightmare! I kept trying to push through thinking the side effects would subside and nope, not even a little bit.",qelbree and caffeine it was a nightmare i kept trying to push through thinking the side effects would subside and nope not even a little bit,[]
qelbree,"Is anyone having a good experience? I've been on Qelbree almost a year and have had a great experience on it (with an exception of when insurance companies were switched and the new one refused to pay for it so I ran out and had those wicked headaches/migraines). 

I'm at 400 mg instead of 600 because I didn't notice a difference between the two improvement-wise. 

As for the reviews, more people are most likely to complain about their bad experiences than praise their good ones. 🤷🏻‍♀️

I had Vyvanse before Qelbree and had a psychotic break on it. I still don't remember those three days or how I managed to drive or care for my kids. I felt like a zombie for a week after I got out of those three days. But I know a ton of people who take Vyvanse and love it. 🤷🏻‍♀️","is anyone having a good experience ive been on qelbree almost a year and have had a great experience on it with an exception of when insurance companies were switched and the new one refused to pay for it so i ran out and had those wicked headachesmigraines 

im at  mg instead of  because i didnt notice a difference between the two improvement wise 

as for the reviews more people are most likely to complain about their bad experiences than praise their good ones 

i had vyvanse before qelbree and had a psychotic break on it i still dont remember those three days or how i managed to drive or care for my kids i felt like a zombie for a week after i got out of those three days but i know a ton of people who take vyvanse and love it",[]
qelbree,Is anyone having a good experience? I’ve been on it for almost little over two weeks. I’m on 400 mg. At first it put me to sleep but now I’m able to function normally. I only got a headache one time when I was very late taking the dosage. I like Qelbree. No complaints here,is anyone having a good experience ive been on it for almost little over two weeks im on  mg at first it put me to sleep but now im able to function normally i only got a headache one time when i was very late taking the dosage i like qelbree no complaints here,[]
qelbree,Is anyone having a good experience? Hey! That sounds like a pretty quick ramp up for dosage and might be why you’re experiencing the headaches. I’ve been on 200mg for a month after straterra didn’t work for me and it’s been a really subtle but helpful change in my symptom management. I feel like I have better task initiation and can control racing thoughts more. I’m not as irritable and it’s helped with anxiety. It did take almost three weeks for the insomnia to die down which was the worst side effect for me.,is anyone having a good experience hey that sounds like a pretty quick ramp up for dosage and might be why youre experiencing the headaches ive been on mg for a month after straterra didnt work for me and its been a really subtle but helpful change in my symptom management i feel like i have better task initiation and can control racing thoughts more im not as irritable and its helped with anxiety it did take almost three weeks for the insomnia to die down which was the worst side effect for me,[]
qelbree,Is anyone having a good experience? That ramp up sounds extreme…. My son has been on it for almost a year and it’s been great. Not as focused as with a stimulant though,is anyone having a good experience that ramp up sounds extreme my son has been on it for almost a year and its been great not as focused as with a stimulant though,[]
qelbree,Is anyone having a good experience? Had a great experience for over a year but it was months until I started upping my dose,is anyone having a good experience had a great experience for over a year but it was months until i started upping my dose,[]
qelbree,"Is anyone having a good experience? No. Lasted 3 weeks. Can't function on 1 hour of sleep a day. Also didn't like the sex function side effect. Nothing appeared to ramp down once I did 2 weeks on 400mg.

Adderall seemed great. No side effects at all. Can't get it in my area, so I tried this crap. No more playing around with pills for me.","is anyone having a good experience no lasted  weeks cant function on  hour of sleep a day also didnt like the sex function side effect nothing appeared to ramp down once i did  weeks on mg

adderall seemed great no side effects at all cant get it in my area so i tried this crap no more playing around with pills for me",[]
qelbree,"Is anyone having a good experience? I’ve been on it about 1yr 9mos, 400mg. At first I had issues with diastolic BP, some afternoon fatigue and nighttime insomnia but those are good now. Only issue I have is if I miss a dose I get a migraine. In fact I almost missed today so took it couple hours ago. 

I took Cuban’s when it first came out and don’t remember having any issues except for cost so I switched to adderral. Once I started working from home and eventually moving/ changing Dr, this is what my new one recommended after retesting.","is anyone having a good experience ive been on it about yr mos mg at first i had issues with diastolic bp some afternoon fatigue and nighttime insomnia but those are good now only issue i have is if i miss a dose i get a migraine in fact i almost missed today so took it couple hours ago 

i took cubans when it first came out and dont remember having any issues except for cost so i switched to adderral once i started working from home and eventually moving changing dr this is what my new one recommended after retesting",[]
qelbree,"Is anyone having a good experience? I made sure to share my somewhat positive post yesterday in this subreddit. I've only been on it for a few days at 200mg but I'm noticing some positive effects. Context, I also haven't tried true stimulants before, so having any actual ADHD treatment feels wonderful. 

Upping 200mg every 5 days feels like an extremely quick timeline, and from my understanding 600mg is the max dosage. Drugs.com says ""Dosage may be titrated in increments of 200 mg weekly to the maximum recommended dosage of 600 mg once daily, **depending on response and tolerability.**"". I know I sure wouldn't be able to say how I'm feeling until the side effects go away and I feel stable for a week. 

One thing to note is that qelbree is considered a non-stimulant because it is a selective norepinephrine reuptake inhibitor, and doesn't manipulate dopamine like stimulants might. It should be treated more like an antidepressant than a stimulant, and you will get some nasty side effects if you suddenly change dosage or stop taking it. That's probably why your doctor said it needs to ""build up in your system"", although the half life is only 7 hours. 

Personally I'm upset your doctor didn't seem to do their research or inform you better... But that also seems to be the theme since it is a newer drug.","is anyone having a good experience i made sure to share my somewhat positive post yesterday in this subreddit ive only been on it for a few days at mg but im noticing some positive effects context i also havent tried true stimulants before so having any actual adhd treatment feels wonderful 

upping mg every  days feels like an extremely quick timeline and from my understanding mg is the max dosage drugscom says dosage may be titrated in increments of  mg weekly to the maximum recommended dosage of  mg once daily depending on response and tolerability i know i sure wouldnt be able to say how im feeling until the side effects go away and i feel stable for a week 

one thing to note is that qelbree is considered a non stimulant because it is a selective norepinephrine reuptake inhibitor and doesnt manipulate dopamine like stimulants might it should be treated more like an antidepressant than a stimulant and you will get some nasty side effects if you suddenly change dosage or stop taking it thats probably why your doctor said it needs to build up in your system although the half life is only  hours 

personally im upset your doctor didnt seem to do their research or inform you better but that also seems to be the theme since it is a newer drug",[]
qelbree,Is anyone having a good experience? Thank you for sharing. I realize the inherent bias of posting online (aka yelp) — just trying to get all sides.,is anyone having a good experience thank you for sharing i realize the inherent bias of posting online aka yelp  just trying to get all sides,[]
qelbree,Is anyone having a good experience? Glad to hear amidst a lot of negative experiences. Cheers!,is anyone having a good experience glad to hear amidst a lot of negative experiences cheers,[]
qelbree,Is anyone having a good experience? helps with executive function?? like task initiation,is anyone having a good experience helps with executive function like task initiation,[]
qelbree,Is anyone having a good experience? Hoping it helps with anxiety as well. Part of the reason I was told to try something other than an amphetamine based medication. Seems like my dosage is a bit higher than I realized though,is anyone having a good experience hoping it helps with anxiety as well part of the reason i was told to try something other than an amphetamine based medication seems like my dosage is a bit higher than i realized though,[]
qelbree,Is anyone having a good experience? Thank you for the response and the info. Going to bring it up with my Psychiatrist,is anyone having a good experience thank you for the response and the info going to bring it up with my psychiatrist,[]
qelbree,"Is anyone having a good experience? Yes, ADHD and some anxiety after a bit more time supposedly",is anyone having a good experience yes adhd and some anxiety after a bit more time supposedly,[]
qelbree,"Qelbree destroyed a month of my life Here with you pal. 
There’s a reason the sticky post on this subreddit is a giant warning to NOT GO COLD TURKEY","qelbree destroyed a month of my life here with you pal 
theres a reason the sticky post on this subreddit is a giant warning to not go cold turkey",[]
qelbree,Qelbree destroyed a month of my life Please please please give this feedback your doctor if you haven’t. The med community needs to take the withdrawal from this drug VERY seriously.,qelbree destroyed a month of my life please please please give this feedback your doctor if you havent the med community needs to take the withdrawal from this drug very seriously,[]
qelbree,"Qelbree destroyed a month of my life I'm sorry YOU had a bad experience with it. It doesn't necessarily mean everyone will have the same experience. I started mine 3 weeks ago. My psych prescribed it to me after stimulants and antidepressants weren't working. 

I take 200mg at night. I sleep very well. It's helped with the ADHD but not the depression. I see my doc tomorrow to adjust meds/dose. 

You really need a psychiatrist to help you with dosing. A primary care doc and pharmacist aren't educated enough to know what works for you. 


As for dissing the meds, your DNA may not react well to it but don't discourage others from trying.","qelbree destroyed a month of my life im sorry you had a bad experience with it it doesnt necessarily mean everyone will have the same experience i started mine  weeks ago my psych prescribed it to me after stimulants and antidepressants werent working 

i take mg at night i sleep very well its helped with the adhd but not the depression i see my doc tomorrow to adjust medsdose 

you really need a psychiatrist to help you with dosing a primary care doc and pharmacist arent educated enough to know what works for you 


as for dissing the meds your dna may not react well to it but dont discourage others from trying",[]
