Drug Name,Review Text,cleaned_comments,side_effects
qelbree,"Anyone have any success appealing their insurance to cover this medicine? This is very helpful..thank you. I wonder if I can “try” strattera again for a little and just say it didn’t work. As for the adderall, my doctor won’t prescribe me stimulants due to me being a recovering addict.",anyone have any success appealing their insurance to cover this medicine this is very helpfulthank you i wonder if i can try strattera again for a little and just say it didnt work as for the adderall my doctor wont prescribe me stimulants due to me being a recovering addict,[]
qelbree,"Anyone have any success appealing their insurance to cover this medicine? My psychiatrist will only let me try one stimulant, concerta. I’m a recovering addict (used to be addicted to Xanax) and she thinks short acting stimulants aren’t a good idea for someone who used to enjoy popping pills.",anyone have any success appealing their insurance to cover this medicine my psychiatrist will only let me try one stimulant concerta im a recovering addict used to be addicted to xanax and she thinks short acting stimulants arent a good idea for someone who used to enjoy popping pills,[]
qelbree,Anyone have any success appealing their insurance to cover this medicine? awesome!! have you noticed it helping with executive function?,anyone have any success appealing their insurance to cover this medicine awesome have you noticed it helping with executive function,[]
qelbree,"Positive/neutral experience so far  I'm on my first week of it at 200mg (going up to 400mg tomorrow).  This is the first ADHD med that hasn't raised my heartrate and anxiety.  My brain is ""quiet"" and I have a MUCH easier time starting tasks that I need to do.  The only negatives I have so far is constipation (but I tend to go through phases where I don't drink enough water or get enough fiber, so that could partially be on me) and maaaaybe some sleep issues (but like, I sometimes am just not tired and will stay up past 2am anyway).  I got diagnosed with ADHD back in the early 00's.  Have tried every ADHD medicine out there since.  Gave up several years ago and just focused on my anxiety/depression issues.  I just decided to bring up the subject with my doctor last year and he told me that they have a couple non stimulants these days.  So I tried Strattera.  Worked decently but made me sweat like crazy for no reason.  I already live in the deep south and get easily overstimulated when sweaty plus skin irritation.  So I gave up on that.  Went back to Concerta for a bit, remembered how much I hate it.  Asked my doctor if there was anything else to try as far as non stimulants and he gave me Qelbree.  I really like it so far.  Hoping the constipation issues lessen over time.",positiveneutral experience so far  im on my first week of it at mg going up to mg tomorrow  this is the first adhd med that hasnt raised my heartrate and anxiety  my brain is quiet and i have a much easier time starting tasks that i need to do  the only negatives i have so far is constipation but i tend to go through phases where i dont drink enough water or get enough fiber so that could partially be on me and maaaaybe some sleep issues but like i sometimes am just not tired and will stay up past am anyway  i got diagnosed with adhd back in the early s  have tried every adhd medicine out there since  gave up several years ago and just focused on my anxietydepression issues  i just decided to bring up the subject with my doctor last year and he told me that they have a couple non stimulants these days  so i tried strattera  worked decently but made me sweat like crazy for no reason  i already live in the deep south and get easily overstimulated when sweaty plus skin irritation  so i gave up on that  went back to concerta for a bit remembered how much i hate it  asked my doctor if there was anything else to try as far as non stimulants and he gave me qelbree  i really like it so far  hoping the constipation issues lessen over time,[]
qelbree,Positive/neutral experience so far  I took it for the first 3 days and my family couldnt it anymore. It makes me jittery and irritable. I stopped taking it for 2 days with intentions of speaking to my doctor about dose and how long this side effect takes to level out... had no Idea for the 1st day by that evening though I got a migraine(I have a history of them though; havent had one in months but attributed it to that). Reddit actually helped clue me in to the fact you cant just stop taking this one. I started back 3 days ago and the lack of sleep is getting to me. I bought some 5mg melatonin... why do u not reccommend it exactly?,positiveneutral experience so far  i took it for the first  days and my family couldnt it anymore it makes me jittery and irritable i stopped taking it for  days with intentions of speaking to my doctor about dose and how long this side effect takes to level out had no idea for the st day by that evening though i got a migrainei have a history of them though havent had one in months but attributed it to that reddit actually helped clue me in to the fact you cant just stop taking this one i started back  days ago and the lack of sleep is getting to me i bought some mg melatonin why do u not reccommend it exactly,[]
qelbree,"Positive/neutral experience so far  Thank you for sharing! I only got diagnosed with ADHD this year, so I'm still trying to figure out what meds and accessibilities I need for myself. I haven't tried stimulants or stratterra yet, so I'm glad I'm not missing out there",positiveneutral experience so far  thank you for sharing i only got diagnosed with adhd this year so im still trying to figure out what meds and accessibilities i need for myself i havent tried stimulants or stratterra yet so im glad im not missing out there,[]
qelbree,"Positive/neutral experience so far  Combining meds that make you awake and make you sleepy tend to not be great for your body. I know for me it felt more torturous to be tired while not being able to sleep, than just staying awake until my body was ready for sleep.

Sounds like you're a week in though, and losing sleep for that long can be actually harmful. Did your doctor give the ok for melatonin? I have yet to ask my doctor how to deal with the side effects.","positiveneutral experience so far  combining meds that make you awake and make you sleepy tend to not be great for your body i know for me it felt more torturous to be tired while not being able to sleep than just staying awake until my body was ready for sleep

sounds like youre a week in though and losing sleep for that long can be actually harmful did your doctor give the ok for melatonin i have yet to ask my doctor how to deal with the side effects",[]
qelbree,"Anyone Know If DE-CAF Coffee Has Any Effect With Qelbree ?  Nope, decaf has no effect, you're good to go! I switched to decaf for the same reason.",anyone know if de caf coffee has any effect with qelbree   nope decaf has no effect youre good to go i switched to decaf for the same reason,[]
qelbree,"Anyone Know If DE-CAF Coffee Has Any Effect With Qelbree ?  Keep in mind that decaf still has *some* caffeine. Usually maxing out around 10mg per 8oz. So you might feel something if you're drinking a trenta or 4+ cups a day, but you're probably fine :)",anyone know if de caf coffee has any effect with qelbree   keep in mind that decaf still has some caffeine usually maxing out around mg per oz so you might feel something if youre drinking a trenta or  cups a day but youre probably fine,[]
qelbree,Anyone Know If DE-CAF Coffee Has Any Effect With Qelbree ?  I had to quit decaf because it was giving me palpitations and anxiety. Psych said it affects everyone differently.,anyone know if de caf coffee has any effect with qelbree   i had to quit decaf because it was giving me palpitations and anxiety psych said it affects everyone differently,[]
qelbree,"Anyone Know If DE-CAF Coffee Has Any Effect With Qelbree ?  Ooo okay thank you! At most I only drink 10oz in a day so I'll just have to try some Decaf and hopefully not 

💥explode💥","anyone know if de caf coffee has any effect with qelbree   ooo okay thank you at most i only drink oz in a day so ill just have to try some decaf and hopefully not 

explode",[]
qelbree,Anyone Know If DE-CAF Coffee Has Any Effect With Qelbree ?  Ahhh okay seems ill just have to try it one day and see what happens!,anyone know if de caf coffee has any effect with qelbree   ahhh okay seems ill just have to try it one day and see what happens,[]
qelbree,Dosage Decrease works better?? Yeah my son went up to 400mg and was fine for a few weeks. Then he started to get over the top anxious and irritable. Went back to 300mg and all good,dosage decrease works better yeah my son went up to mg and was fine for a few weeks then he started to get over the top anxious and irritable went back to mg and all good,[]
qelbree,Dosage Decrease works better?? I feel like that is about what happened with me. My husband was getting worried cause I was talking so so fast and my words were just jumbled together. Inwas gittery and anxious all the time. Never thought upping it would make a difference like that.,dosage decrease works better i feel like that is about what happened with me my husband was getting worried cause i was talking so so fast and my words were just jumbled together inwas gittery and anxious all the time never thought upping it would make a difference like that,[]
qelbree,"6 year old prescribed Qelbree. Any advice? As with a lot of drugs, you have to taper off these if you want to stop.   There's a lot of stories here about adults missing a dose and getting migraines.

I missed a dose and I did get a headache, but it wasn't terrible and 500mg of tylenol took care of it

I think there's a facebook group that deals with kids and this drug, seems like mostly adult patients post here","year old prescribed qelbree any advice as with a lot of drugs you have to taper off these if you want to stop   theres a lot of stories here about adults missing a dose and getting migraines

i missed a dose and i did get a headache but it wasnt terrible and mg of tylenol took care of it

i think theres a facebook group that deals with kids and this drug seems like mostly adult patients post here",[]
qelbree,"6 year old prescribed Qelbree. Any advice? No personal or anecdotal experience, no knowledge of the effects of withdrawal in children, and not a doctor or pediatrician - but I've been on Qelbree's side effect webpage to look at the most common side effects in individuals aged 6-17 and individuals aged 18+. As you can see, headaches and migraines don't make the common side effect list for kids: https://www.qelbreehcp.com/side-effects",year old prescribed qelbree any advice no personal or anecdotal experience no knowledge of the effects of withdrawal in children and not a doctor or pediatrician   but ive been on qelbrees side effect webpage to look at the most common side effects in individuals aged   and individuals aged  as you can see headaches and migraines dont make the common side effect list for kids httpswwwqelbreehcpcomside effects,[]
qelbree,"6 year old prescribed Qelbree. Any advice? I'd say don't start it right away. Wait at least 3 days to a week, but then refill it at the exact time that you are supposed to. A couple have posters have mentioned it is starting to get back ordered in their area and they have had to go several days without and experienced horrible withdrawals. If that happens in your area, you will now have a 3 to 7 day window, while waiting for meds to come in.",year old prescribed qelbree any advice id say dont start it right away wait at least  days to a week but then refill it at the exact time that you are supposed to a couple have posters have mentioned it is starting to get back ordered in their area and they have had to go several days without and experienced horrible withdrawals if that happens in your area you will now have a  to  day window while waiting for meds to come in,[]
qelbree,6 year old prescribed Qelbree. Any advice? My son takes it. He never had any bad side effects. The only thing was sleep issues the first few weeks but we changed the time he gets it.,year old prescribed qelbree any advice my son takes it he never had any bad side effects the only thing was sleep issues the first few weeks but we changed the time he gets it,[]
qelbree,"6 year old prescribed Qelbree. Any advice? I had a really bad experience getting off of Qelbree. It caused me disassociation and feelings of disconnect. I was on a very low dose, but when I stopped it, I experience the worst migraine of my life. I was in horrific pain and was severely ill for days. 

I know different people react differently to different medicines, but I've read about a lot of people here that have been through similar withdrawal symptoms with Qelbree. I personally wouldn't want to risk it. I wish you luck!","year old prescribed qelbree any advice i had a really bad experience getting off of qelbree it caused me disassociation and feelings of disconnect i was on a very low dose but when i stopped it i experience the worst migraine of my life i was in horrific pain and was severely ill for days 

i know different people react differently to different medicines but ive read about a lot of people here that have been through similar withdrawal symptoms with qelbree i personally wouldnt want to risk it i wish you luck",[]
qelbree,6 year old prescribed Qelbree. Any advice? Been on it and can’t believe it is for kids. Altered my sense of self and made me feel disassociated. In my opinion no one under 16 should be on this.,year old prescribed qelbree any advice been on it and cant believe it is for kids altered my sense of self and made me feel disassociated in my opinion no one under  should be on this,[]
qelbree,"Is it normal to have no improvement after 1 month on Qelbree? I started on 200mg and didn't notice any improvement, but a bunch of side effects. I was convinced I'd be asking my psych to take me off it next appointment. But the moment I moved up to 400mg, the change was obvious and immediate. Do with that what you will",is it normal to have no improvement after  month on qelbree i started on mg and didnt notice any improvement but a bunch of side effects i was convinced id be asking my psych to take me off it next appointment but the moment i moved up to mg the change was obvious and immediate do with that what you will,[]
qelbree,Is it normal to have no improvement after 1 month on Qelbree? Ive been on 200 for about a week and still don’t feel too many benefits either. But I did want to say that a fiber supplement has really helped the constipation for me. I also am drinking more water as well but I definitely have noticed a huge difference since upping my fiber. I got the Metamucil fiber gummies. Hope that helps with that at least,is it normal to have no improvement after  month on qelbree ive been on  for about a week and still dont feel too many benefits either but i did want to say that a fiber supplement has really helped the constipation for me i also am drinking more water as well but i definitely have noticed a huge difference since upping my fiber i got the metamucil fiber gummies hope that helps with that at least,[]
qelbree,"Is it normal to have no improvement after 1 month on Qelbree? I started on 200mg. I tried it for a week and a couple days, I had every side effect possible. But I did notice an improvement in my adhd. But if you’re having no improvement I’d recommend getting off it and talking to your psychiatrist.",is it normal to have no improvement after  month on qelbree i started on mg i tried it for a week and a couple days i had every side effect possible but i did notice an improvement in my adhd but if youre having no improvement id recommend getting off it and talking to your psychiatrist,[]
qelbree,"Is it normal to have no improvement after 1 month on Qelbree? You’re not alone in that, I started at 100mg , didn’t notice a difference just went up to 150mg still nothing, so I’m going up to 200mg. Hopefully, if you decide to keep taking it your side effects will lessen as your body adjust then maybe going up will give you better benefits , maybe you could try 150mg before 200mg , I’d ask your dr about it if you’d like. I hope you get things figured out, hang in there it’s always hard trying out medications figuring out what’s best.!🤍",is it normal to have no improvement after  month on qelbree youre not alone in that i started at mg  didnt notice a difference just went up to mg still nothing so im going up to mg hopefully if you decide to keep taking it your side effects will lessen as your body adjust then maybe going up will give you better benefits  maybe you could try mg before mg  id ask your dr about it if youd like i hope you get things figured out hang in there its always hard trying out medications figuring out whats best,[]
qelbree,"Is it normal to have no improvement after 1 month on Qelbree? I started noticing improvements at 300mg.   (at 600mg now)

I also went up slowly, 50mg per week (had to divide the beads in the capsule).   Now I have almost no side effects unless I have any amount of caffeine.","is it normal to have no improvement after  month on qelbree i started noticing improvements at mg   at mg now

i also went up slowly mg per week had to divide the beads in the capsule   now i have almost no side effects unless i have any amount of caffeine",[]
qelbree,Is it normal to have no improvement after 1 month on Qelbree? Same with me.,is it normal to have no improvement after  month on qelbree same with me,[]
qelbree,"I have bad experiences with other ADHD medications, but so far Qelbree is working. I had bad side effects that mostly went away after a week. Your call out on anxiety matches some of my experience. I am WAY less anxious throughout my workday and get way more done. But I am WAY more anxious when I first wake up. Probably doesn’t help that I am sleeping worse but feel this optimism during the day that everything will work out. 

I am only on day 5 of the increased dose to 400mg but I also feel pretty immediate impacts.","i have bad experiences with other adhd medications but so far qelbree is working i had bad side effects that mostly went away after a week your call out on anxiety matches some of my experience i am way less anxious throughout my workday and get way more done but i am way more anxious when i first wake up probably doesnt help that i am sleeping worse but feel this optimism during the day that everything will work out 

i am only on day  of the increased dose to mg but i also feel pretty immediate impacts",[]
qelbree,"I have bad experiences with other ADHD medications, but so far Qelbree is working. I had bad side effects that mostly went away after a week. yea definitely starts working immediately and i can understand the parallels you see vs stimulants. for me it increases wakefulness too. it really doesnt do much as far as dopamine is concerned which is a good thing because that makes it non-addictive! norepinepherine is responsible for focus anyhow, so the only thing this medication lacks is the motivation that dopamine gives. DONT FUCKING ABRUPTLY STOP TAKING IT THOUGH. shit landed me in the ER this past weekend!",i have bad experiences with other adhd medications but so far qelbree is working i had bad side effects that mostly went away after a week yea definitely starts working immediately and i can understand the parallels you see vs stimulants for me it increases wakefulness too it really doesnt do much as far as dopamine is concerned which is a good thing because that makes it non addictive norepinepherine is responsible for focus anyhow so the only thing this medication lacks is the motivation that dopamine gives dont fucking abruptly stop taking it though shit landed me in the er this past weekend,[]
qelbree,"I have bad experiences with other ADHD medications, but so far Qelbree is working. I had bad side effects that mostly went away after a week. Tonight I got really anxious and irritable so I'm not sure this is working after all. I'm going to stick to it for a few more weeks but I might have to quit.",i have bad experiences with other adhd medications but so far qelbree is working i had bad side effects that mostly went away after a week tonight i got really anxious and irritable so im not sure this is working after all im going to stick to it for a few more weeks but i might have to quit,[]
qelbree,"I have bad experiences with other ADHD medications, but so far Qelbree is working. I had bad side effects that mostly went away after a week. Me too . Iam scared",i have bad experiences with other adhd medications but so far qelbree is working i had bad side effects that mostly went away after a week me too  iam scared,[]
qelbree,"I have bad experiences with other ADHD medications, but so far Qelbree is working. I had bad side effects that mostly went away after a week. Really weird that your dr says it doesn't do anything right away.  I noticed it on day one.  My brain was ""quiet"" for the first time in, idk how long.  Stimulant ADHD meds always put my anxiety & heart rate through the roof.  I tried tons of them over the years and finally gave up.  Hears about non stimulant meds and talked to my doctor.  He put me on Strattera which worked well but made me sweat like crazy for no reason.  Nothing overstimulates me faster than sweating... and I live in the deep south.  Bad combo!  Started on Qelbree a week ago and it's great.  I have been a bit constipated but gonna take more fiber and stuff and see if that doesn't straighten things out for me.  But yea, when my brain is ""quiet"" like this, I don't get overstimulated nearly as fast by noise.  Normally a trip to Costco has me in a whole mood by the end of it.  My mood stayed steady all the way through this time.",i have bad experiences with other adhd medications but so far qelbree is working i had bad side effects that mostly went away after a week really weird that your dr says it doesnt do anything right away  i noticed it on day one  my brain was quiet for the first time in idk how long  stimulant adhd meds always put my anxiety  heart rate through the roof  i tried tons of them over the years and finally gave up  hears about non stimulant meds and talked to my doctor  he put me on strattera which worked well but made me sweat like crazy for no reason  nothing overstimulates me faster than sweating and i live in the deep south  bad combo  started on qelbree a week ago and its great  i have been a bit constipated but gonna take more fiber and stuff and see if that doesnt straighten things out for me  but yea when my brain is quiet like this i dont get overstimulated nearly as fast by noise  normally a trip to costco has me in a whole mood by the end of it  my mood stayed steady all the way through this time,[]
qelbree,"I have bad experiences with other ADHD medications, but so far Qelbree is working. I had bad side effects that mostly went away after a week. Oh wow…. Thanks for letting us know .. I’m starting this soon and sometimes I’ve abruptly stopped meds in this past. Did you just go from the 400 to 200mg?",i have bad experiences with other adhd medications but so far qelbree is working i had bad side effects that mostly went away after a week oh wow thanks for letting us know  im starting this soon and sometimes ive abruptly stopped meds in this past did you just go from the  to mg,[]
qelbree,"I have bad experiences with other ADHD medications, but so far Qelbree is working. I had bad side effects that mostly went away after a week. Yeah when I missed a dose because of the pharmacy, I also ended up in an ER because my head ache was intolerable.",i have bad experiences with other adhd medications but so far qelbree is working i had bad side effects that mostly went away after a week yeah when i missed a dose because of the pharmacy i also ended up in an er because my head ache was intolerable,[]
qelbree,"I have bad experiences with other ADHD medications, but so far Qelbree is working. I had bad side effects that mostly went away after a week. Starting this tomorrow not looking forward to it after some of comments/post I’ve read",i have bad experiences with other adhd medications but so far qelbree is working i had bad side effects that mostly went away after a week starting this tomorrow not looking forward to it after some of commentspost ive read,[]
qelbree,"I have bad experiences with other ADHD medications, but so far Qelbree is working. I had bad side effects that mostly went away after a week. went from 400 a day to 0 because of a pharmacy delay on ordering it. just make sure they order it ahead of time. a simple quick convo with the pharmacist should make this a non-issue",i have bad experiences with other adhd medications but so far qelbree is working i had bad side effects that mostly went away after a week went from  a day to  because of a pharmacy delay on ordering it just make sure they order it ahead of time a simple quick convo with the pharmacist should make this a non issue,[]
qelbree,"I have bad experiences with other ADHD medications, but so far Qelbree is working. I had bad side effects that mostly went away after a week. What were the symptoms that landed you in the hospital?! I have the sample as of rn from the doctor so will make sure to talk to the pharmacy ahead of time",i have bad experiences with other adhd medications but so far qelbree is working i had bad side effects that mostly went away after a week what were the symptoms that landed you in the hospital i have the sample as of rn from the doctor so will make sure to talk to the pharmacy ahead of time,[]
