Drug Name,Review Text,cleaned_comments,side_effects
qelbree,"Teenage daughter, possible Mania? Hey! I can offer perspective from a 20 year old who was VERY similar when I was her age. Wild hormones and dramatic & over-the-top reactions to things are super common in teen years. It becomes problematic when it starts interfering with daily functioning (school, her friendships, sleep schedule, physical energy levels, eating, etc) for extended periods of time. If this is the case, my #1 recommendation is to get her a good physiatrist & therapist. The psych NP you’re seeing is likely trying their best, & may or may not be the right fit, just pay attention to those details. I’d also highly recommend starting therapy for yourself as well, dealing with a kid’s mental health issues can really take a toll and you deserve support too. I won’t lie to you, finding the right providers and meds is a lengthy and exhaustive process, listen to your daughter’s concerns & if she truly feels something isn’t right try something different. Take this with a grain of salt because there’s a chance your daughter is just facing normal teenage outbursts. Even if she isn’t everyone has very different journeys with adolescent mental health struggles, this is just my experience. You’re doing an amazing job recognizing these things and caring for your daughter, be proud of yourself for that & if you have any more questions feel free to ask.",teenage daughter possible mania hey i can offer perspective from a  year old who was very similar when i was her age wild hormones and dramatic  over the top reactions to things are super common in teen years it becomes problematic when it starts interfering with daily functioning school her friendships sleep schedule physical energy levels eating etc for extended periods of time if this is the case my  recommendation is to get her a good physiatrist  therapist the psych np youre seeing is likely trying their best  may or may not be the right fit just pay attention to those details id also highly recommend starting therapy for yourself as well dealing with a kids mental health issues can really take a toll and you deserve support too i wont lie to you finding the right providers and meds is a lengthy and exhaustive process listen to your daughters concerns  if she truly feels something isnt right try something different take this with a grain of salt because theres a chance your daughter is just facing normal teenage outbursts even if she isnt everyone has very different journeys with adolescent mental health struggles this is just my experience youre doing an amazing job recognizing these things and caring for your daughter be proud of yourself for that  if you have any more questions feel free to ask,[]
qelbree,"4 weeks in. I’m done, and here’s how I’m titrating down How has it been going? I also need to get off qelbree",weeks in im done and heres how im titrating down how has it been going i also need to get off qelbree,[]
qelbree,"4 weeks in. I’m done, and here’s how I’m titrating down Just chiming in with the other commenter to see how it's going.",weeks in im done and heres how im titrating down just chiming in with the other commenter to see how its going,[]
qelbree,"4 weeks in. I’m done, and here’s how I’m titrating down I just cold turkeyed at 3.5 weeks. Felt better honestly since the med was making me feel so god awful. Never noticed much withdrawal.",weeks in im done and heres how im titrating down i just cold turkeyed at  weeks felt better honestly since the med was making me feel so god awful never noticed much withdrawal,[]
qelbree,"4 weeks in. I’m done, and here’s how I’m titrating down It went ok for me! I still had some headaches for the first day or so that I was off the medication. 

I’ll make an edit to my post.","weeks in im done and heres how im titrating down it went ok for me i still had some headaches for the first day or so that i was off the medication 

ill make an edit to my post",[]
qelbree,"4 weeks in. I’m done, and here’s how I’m titrating down I made it through! Had some headaches on Tuesday that I was able to get through with some ibuprofen",weeks in im done and heres how im titrating down i made it through had some headaches on tuesday that i was able to get through with some ibuprofen,[]
qelbree,"4 weeks in. I’m done, and here’s how I’m titrating down Thanks for the response!! Glad to hear that it went okay :)",weeks in im done and heres how im titrating down thanks for the response glad to hear that it went okay,[]
qelbree,"Anyone prescribed Qelbree and Ritalin together? Yes, I take 300mg of Qelbree and 5mg of Ritalin 2-3 times a day as needed. Compared to taking Ritalin without Qelbree, I think it helps lessen the crash or helps the effect last longer.",anyone prescribed qelbree and ritalin together yes i take mg of qelbree and mg of ritalin   times a day as needed compared to taking ritalin without qelbree i think it helps lessen the crash or helps the effect last longer,[]
qelbree,Anyone prescribed Qelbree and Ritalin together? My son is on 300 mg of qelbree and then Ritalin 5mg 2 or 3 times a day. We just added the Ritalin and so far so good,anyone prescribed qelbree and ritalin together my son is on  mg of qelbree and then ritalin mg  or  times a day we just added the ritalin and so far so good,[]
qelbree,"Anyone prescribed Qelbree and Ritalin together? I'm similar. 200mg Qelbree, 10mg of Ritalin 2-3 times per day. I agree Qelbree helps with the crash. I was ready to quit stimulants because I was so cranky and hungry at the end of the day, but Qelbree helped. Qelbree on its own wasn't enough though, still needed the stim.",anyone prescribed qelbree and ritalin together im similar mg qelbree mg of ritalin   times per day i agree qelbree helps with the crash i was ready to quit stimulants because i was so cranky and hungry at the end of the day but qelbree helped qelbree on its own wasnt enough though still needed the stim,[]
qelbree,Interaction with mushrooms? Yeah i wouldn’t do this,interaction with mushrooms yeah i wouldnt do this,[]
qelbree,"Interaction with mushrooms? don't take this as any sort of advice, but I looked into this.   There's no experience reports I could find.

Since psilocybin in part acts on nor-epinephrine, I suspect there would be an amplification of either or both drug.   So both at the same time would probably be bad time - high anxiety, high heart rate and blood pressure.    But I also suspect if one stopped the Q for a couple days and let it wash out, it might be ok.  <--  Not advice, just speculation","interaction with mushrooms dont take this as any sort of advice but i looked into this   theres no experience reports i could find

since psilocybin in part acts on nor epinephrine i suspect there would be an amplification of either or both drug   so both at the same time would probably be bad time   high anxiety high heart rate and blood pressure    but i also suspect if one stopped the q for a couple days and let it wash out it might be ok      not advice just speculation",[]
qelbree,"Interaction with mushrooms? Allow the medicine time enough to get established in your body chemistry before adding something else like psilocybin. I don’t see anything bad happening to you in my opinion. I have  experience with micro dosing psilocybin. Just start at a low enough dose that you’re not in danger of seratonin syndrome. Be smart, precise, persistent, and methodical and you will be fine.. also talk to your doctor.. they’re all about microdosing!!",interaction with mushrooms allow the medicine time enough to get established in your body chemistry before adding something else like psilocybin i dont see anything bad happening to you in my opinion i have  experience with micro dosing psilocybin just start at a low enough dose that youre not in danger of seratonin syndrome be smart precise persistent and methodical and you will be fine also talk to your doctor theyre all about microdosing,[]
qelbree,Interaction with mushrooms? Only thing I’ve found on reddit so far is that you might need a higher dose,interaction with mushrooms only thing ive found on reddit so far is that you might need a higher dose,[]
qelbree,"Day 2, awful symptoms.  Damn i started at 100mg then went up to 200mg i think maybe that was just too much for ur body at once",day  awful symptoms  damn i started at mg then went up to mg i think maybe that was just too much for ur body at once,[]
qelbree,"Day 2, awful symptoms.  I had to start at 50mg and go up by 50 once a week.    Sounds like a high starting dose.

Doctors don't know how to prescribe this stuff","day  awful symptoms  i had to start at mg and go up by  once a week    sounds like a high starting dose

doctors dont know how to prescribe this stuff",[]
qelbree,"Day 2, awful symptoms.  Literally took my first dose yesterday and had the same— headache and nausea, I woke up 12 separate times last night (my watch tracked it although it was definitely more than 12) - still nauseated today. 

Personally, I’m refusing to continue it. I tried Strattera over 12 years ago and felt the same even after a few months, so I was moved to adderall which has worked great for me ever since. My new doc wanted me to add in Qelbree but I’m telling her to go F herself after this","day  awful symptoms  literally took my first dose yesterday and had the same headache and nausea i woke up  separate times last night my watch tracked it although it was definitely more than    still nauseated today 

personally im refusing to continue it i tried strattera over  years ago and felt the same even after a few months so i was moved to adderall which has worked great for me ever since my new doc wanted me to add in qelbree but im telling her to go f herself after this",[]
qelbree,"Day 2, awful symptoms.  yes. it sucks... but it does get better.",day  awful symptoms  yes it sucks but it does get better,[]
qelbree,"Day 2, awful symptoms.  I would suggest starting at 100mg and working your day up. 

Also, based on personal experience - this might be some evidence of an autonomic disorder like POTS, especially if you have other symptoms like dizziness and increased heart rate upon standing. Some say nearly 50% of people with ADHD have POTS and norepinephrine-reuptake inhibitors like Qelbree will make it worse.

That said, maybe try pairing the meds with electrolytes a couple times a day to see if that helps.","day  awful symptoms  i would suggest starting at mg and working your day up 

also based on personal experience   this might be some evidence of an autonomic disorder like pots especially if you have other symptoms like dizziness and increased heart rate upon standing some say nearly  of people with adhd have pots and norepinephrine reuptake inhibitors like qelbree will make it worse

that said maybe try pairing the meds with electrolytes a couple times a day to see if that helps",[]
qelbree,"Day 2, awful symptoms.  Just started mine yesterday 2x 200mg a day . And ngl i feel numb and hot asf . And my vision feels super bright for some reason.",day  awful symptoms  just started mine yesterday x mg a day  and ngl i feel numb and hot asf  and my vision feels super bright for some reason,[]
qelbree,"Day 2, awful symptoms.  I was given the big blue capsules, 200mg. I can't split them in half 😕 I feel absolutely awful but I don't want to seem like I'm not giving the medicine a chance.",day  awful symptoms  i was given the big blue capsules mg i cant split them in half  i feel absolutely awful but i dont want to seem like im not giving the medicine a chance,[]
qelbree,"Day 2, awful symptoms.  I took my first dose of 100mg last week and it made me super irritable, agitated, and tired. I stopped taking it after day one and my doctor said that was the right move if it impacted me that much after one dose.",day  awful symptoms  i took my first dose of mg last week and it made me super irritable agitated and tired i stopped taking it after day one and my doctor said that was the right move if it impacted me that much after one dose,[]
qelbree,"Day 2, awful symptoms.  I was only on qelbree for like two weeks the side effects were so bad (i experienced all the ones you mentioned too) and it didn’t give me any benefit. The psych who took me off qelbree was not the same one that prescribed it and her words “that’s what we give to little boys who can’t stop punching walls”. If u want to be on a non-stimulant I did have a lot of success with straterra when I was on it so that may be worth a try but I’m on adderall now and that’s worked the best for me so far",day  awful symptoms  i was only on qelbree for like two weeks the side effects were so bad i experienced all the ones you mentioned too and it didnt give me any benefit the psych who took me off qelbree was not the same one that prescribed it and her words thats what we give to little boys who cant stop punching walls if u want to be on a non stimulant i did have a lot of success with straterra when i was on it so that may be worth a try but im on adderall now and thats worked the best for me so far,[]
qelbree,"Day 2, awful symptoms.  Starting at 200mg is way too high it is supposed to be treated up slowly. Starting at the lowest dose and working your way up as high as you need.",day  awful symptoms  starting at mg is way too high it is supposed to be treated up slowly starting at the lowest dose and working your way up as high as you need,[]
qelbree,"Day 2, awful symptoms.  Curious how old are you all? I was told to put my young son on Quelbree 200 mg . ",day  awful symptoms  curious how old are you all i was told to put my young son on quelbree  mg,[]
qelbree,"Day 2, awful symptoms.  Did you have side effects from 50mg?",day  awful symptoms  did you have side effects from mg,[]
qelbree,"Day 2, awful symptoms.  You can open them up and sprinkle some into some applesauce",day  awful symptoms  you can open them up and sprinkle some into some applesauce,[]
qelbree,"Day 2, awful symptoms.  Maybe try skipping a day to give your body time to adjust? You could always call your doc and get the prescription changed too and just save your 200mg pills for when you're ready to bump up.",day  awful symptoms  maybe try skipping a day to give your body time to adjust you could always call your doc and get the prescription changed too and just save your mg pills for when youre ready to bump up,[]
qelbree,"Day 2, awful symptoms.  only the first day or two - a tiny bit of anxiety and it was a bit harder to get to sleep.   After that it smoothed out.",day  awful symptoms  only the first day or two   a tiny bit of anxiety and it was a bit harder to get to sleep   after that it smoothed out,[]
qelbree,Does the sleep ever improve? (plz read i need help) When do you take Qelbree? My son is on it and had some insomnia taking it before bed. We switched it to the AM and the insomnia went away. Then we found out he was crashing at school after lunch. Now he takes it around dinner and all is well,does the sleep ever improve plz read i need help when do you take qelbree my son is on it and had some insomnia taking it before bed we switched it to the am and the insomnia went away then we found out he was crashing at school after lunch now he takes it around dinner and all is well,[]
qelbree,Does the sleep ever improve? (plz read i need help) Do you drink caffeine or take melatonin?,does the sleep ever improve plz read i need help do you drink caffeine or take melatonin,[]
qelbree,"Does the sleep ever improve? (plz read i need help) first week at 200 mg I had the most detailed and interesting dreams. second week I found it difficult to fall asleep a lot. third week I went up to 400 and 4th week my pharmacy screwed up and I had to withdraw for almost 4 days. that was hell. 

all that being said I am now back at 400 after the withdrawal and I have to say my symptoms are gradually all disappearing. and I am noticing and improvement in my ADHD symptoms. not necessarily what I did on Adderall but I've only been doing this 4 weeks now so.","does the sleep ever improve plz read i need help first week at  mg i had the most detailed and interesting dreams second week i found it difficult to fall asleep a lot third week i went up to  and th week my pharmacy screwed up and i had to withdraw for almost  days that was hell 

all that being said i am now back at  after the withdrawal and i have to say my symptoms are gradually all disappearing and i am noticing and improvement in my adhd symptoms not necessarily what i did on adderall but ive only been doing this  weeks now so",[]
qelbree,Does the sleep ever improve? (plz read i need help) Sort of.   But I ended up being given 7.5mg remeron for sleep and it works great.,does the sleep ever improve plz read i need help sort of   but i ended up being given mg remeron for sleep and it works great,[]
qelbree,"Does the sleep ever improve? (plz read i need help) no caffeine and yes melatonin, but again, i am really sick fever and cough wise so that could be a factor right?",does the sleep ever improve plz read i need help no caffeine and yes melatonin but again i am really sick fever and cough wise so that could be a factor right,[]
qelbree,"Does the sleep ever improve? (plz read i need help) That could be a factor, but Qelbree does affect many peoples' sleep cycles as their bodies adjust to the medication. Qelbree affects your body's ability to break down melatonin and caffeine, so I would stop the melatonin use and see how your body adjusts. Full disclosure, my sleep was absolutely awful for 2 weeks, but I'm almost 2 months on Qelbree now and my sleep is more consistent than it was before! Everyone is different though, and it is hard to pin down the cause when you're sick. Take care of yourself, and remember, resting with your eyes closed is better for your body than being up and moving when you can't sleep. I hope you feel better soon!",does the sleep ever improve plz read i need help that could be a factor but qelbree does affect many peoples sleep cycles as their bodies adjust to the medication qelbree affects your bodys ability to break down melatonin and caffeine so i would stop the melatonin use and see how your body adjusts full disclosure my sleep was absolutely awful for  weeks but im almost  months on qelbree now and my sleep is more consistent than it was before everyone is different though and it is hard to pin down the cause when youre sick take care of yourself and remember resting with your eyes closed is better for your body than being up and moving when you cant sleep i hope you feel better soon,[]
qelbree,Does the sleep ever improve? (plz read i need help) do you sleep a full 8 hours uninterrupted now?,does the sleep ever improve plz read i need help do you sleep a full  hours uninterrupted now,[]
qelbree,"Does the sleep ever improve? (plz read i need help) i had the same experience as the above comment and i sleep pretty well now. it is harder to fall asleep than not being on it, but i can bang out 8 hrs of sleep no problem.",does the sleep ever improve plz read i need help i had the same experience as the above comment and i sleep pretty well now it is harder to fall asleep than not being on it but i can bang out  hrs of sleep no problem,[]
qelbree,Does the sleep ever improve? (plz read i need help) was it hard to fall asleep when u first started taking it? it knocked me out,does the sleep ever improve plz read i need help was it hard to fall asleep when u first started taking it it knocked me out,[]
qelbree,Any of you also take Wellbutrin? What’s your experience been  works great they compliment one another. wellbutrin makes you happier while qelbree helps you focus,any of you also take wellbutrin whats your experience been  works great they compliment one another wellbutrin makes you happier while qelbree helps you focus,[]
qelbree,"Any of you also take Wellbutrin? What’s your experience been  I took Wellbutrin and felt emotionally blunted with major depression coming off it. I changed to Qelbree and felt better. The thing with Qebree is that when you are taking it you won't notice an immediate switch like you would when you take stimulants. However, it still works great. Hope this was helpful",any of you also take wellbutrin whats your experience been  i took wellbutrin and felt emotionally blunted with major depression coming off it i changed to qelbree and felt better the thing with qebree is that when you are taking it you wont notice an immediate switch like you would when you take stimulants however it still works great hope this was helpful,[]
qelbree,"Any of you also take Wellbutrin? What’s your experience been  I take Wellbutrin in combo with Lamictal and added Qelbree last week. I absolutely love Wellbutrin and don’t mind being on it forever if I can remain functional lol. I’m one week into Qelbree and I’m happy with what effects I’ve noticed, aside from the rash I’ve developed on my right wrist.",any of you also take wellbutrin whats your experience been  i take wellbutrin in combo with lamictal and added qelbree last week i absolutely love wellbutrin and dont mind being on it forever if i can remain functional lol im one week into qelbree and im happy with what effects ive noticed aside from the rash ive developed on my right wrist,[]
qelbree,"Any of you also take Wellbutrin? What’s your experience been  Didn't take it with Qelbree, but there's never been a drug that made me feel as happy as Wellbutrin. It didn't do jack for helping me get my shit together, so ultimately I stopped taking it in favor of other drugs that work better for ADHD. But damn if it didn't make me feel good even though my life was in shambles, lol.",any of you also take wellbutrin whats your experience been  didnt take it with qelbree but theres never been a drug that made me feel as happy as wellbutrin it didnt do jack for helping me get my shit together so ultimately i stopped taking it in favor of other drugs that work better for adhd but damn if it didnt make me feel good even though my life was in shambles lol,[]
qelbree,Any of you also take Wellbutrin? What’s your experience been  Wellbutrin helped my depression and ADHD a lot! I still had some anxiety and irritability so I also take a small dose of Prozac with it. I just started Qelvree and so far have noticed a slight increase in irritability. Hopefully it’s only temporary.,any of you also take wellbutrin whats your experience been  wellbutrin helped my depression and adhd a lot i still had some anxiety and irritability so i also take a small dose of prozac with it i just started qelvree and so far have noticed a slight increase in irritability hopefully its only temporary,[]
qelbree,Any of you also take Wellbutrin? What’s your experience been  I've been on Wellbutrin for 1.5 years and it's been great for my mood. Does zero for my ADHD. I've been on Qelbree for almost 2 months (upping dosage during that time) and haven't noticed anything bad with taking both. The jury is still out of qelbree is doing much for my ADHD though.,any of you also take wellbutrin whats your experience been  ive been on wellbutrin for  years and its been great for my mood does zero for my adhd ive been on qelbree for almost  months upping dosage during that time and havent noticed anything bad with taking both the jury is still out of qelbree is doing much for my adhd though,[]
qelbree,Any of you also take Wellbutrin? What’s your experience been  Hi do you think ur allergic or that’s normal? I know it’s diff med but I started Strattera a few days ago and have been itchy,any of you also take wellbutrin whats your experience been  hi do you think ur allergic or thats normal i know its diff med but i started strattera a few days ago and have been itchy,[]
qelbree,Any of you also take Wellbutrin? What’s your experience been  If it’s an allergy it’s extremely mild since it’s only a small amounts of bumps. And They itch sporadically. I called my psych today and hoping to get more info from her tomorrow.,any of you also take wellbutrin whats your experience been  if its an allergy its extremely mild since its only a small amounts of bumps and they itch sporadically i called my psych today and hoping to get more info from her tomorrow,[]
qelbree,Qelbree + Adderall?? My personal dark opinion is they are getting huge kickbacks from big pharma for prescribing it. I don’t like it and I don’t trust it.,qelbree  adderall my personal dark opinion is they are getting huge kickbacks from big pharma for prescribing it i dont like it and i dont trust it,[]
qelbree,"Qelbree + Adderall?? Exactly what I did - the two medicines work brilliantly together. Strattera gave me so many side effects - qelbree seems like a cleaner version of what strattera was trying to do… 

I’m also sensitive to meds as well and I plan on staying at the starter qelbree dose. It’s kinda nice not having to completely rely on the adderall honestly.","qelbree  adderall exactly what i did   the two medicines work brilliantly together strattera gave me so many side effects   qelbree seems like a cleaner version of what strattera was trying to do 

im also sensitive to meds as well and i plan on staying at the starter qelbree dose its kinda nice not having to completely rely on the adderall honestly",[]
