Drug Name,Review Text,cleaned_comments,side_effects
qelbree,"Switching from a Stimulant because of having OCD too… I’m way less tired. I actually worked for 13 hours straight on a project yesterday with zero need for my usual 3 hour midday nap. It’s also been two weeks since I switched to vybriid from Zoloft. I remember other medications hitting me with the involuntary naps by now, regardless of the qelbree, so ime the qelbree isn’t the problem with drowsiness. 
And weight is stable so far, it’s easier to find the will to workout. No decrease in libido, which buspar personally helped with.

Stimulants definitely made me focus on the most uncomfortable thoughts, and I used to tell myself it made me better at my job and all that, but in reality it was a very precarious way to live, not only because of shortages and the feeling of withdrawal or like I could skip weekends to take an extra dose on Monday, etc. it was precarious because the second I lost focus on a “good” or wanted thought/task, the negativity would rush in and I’d be 90% less effective, or “happy”","switching from a stimulant because of having ocd too im way less tired i actually worked for  hours straight on a project yesterday with zero need for my usual  hour midday nap its also been two weeks since i switched to vybriid from zoloft i remember other medications hitting me with the involuntary naps by now regardless of the qelbree so ime the qelbree isnt the problem with drowsiness 
and weight is stable so far its easier to find the will to workout no decrease in libido which buspar personally helped with

stimulants definitely made me focus on the most uncomfortable thoughts and i used to tell myself it made me better at my job and all that but in reality it was a very precarious way to live not only because of shortages and the feeling of withdrawal or like i could skip weekends to take an extra dose on monday etc it was precarious because the second i lost focus on a good or wanted thoughttask the negativity would rush in and id be  less effective or happy",[]
qelbree,"Switching from a Stimulant because of having OCD too… Haha I hear ya! I had many of the clean freak earlier on, now I have more of the intrusive thoughts. Do u get those too? Any weight gain or sexual side effects with the Zoloft?",switching from a stimulant because of having ocd too haha i hear ya i had many of the clean freak earlier on now i have more of the intrusive thoughts do u get those too any weight gain or sexual side effects with the zoloft,[]
qelbree,Switching from a Stimulant because of having OCD too… I’ve read Prozac can be stimulating for people who have ADD too. Do u take the Viibryd at night or in the morning? Have u heard anything about the drug Intuniv which is similar to Qelbree?,switching from a stimulant because of having ocd too ive read prozac can be stimulating for people who have add too do u take the viibryd at night or in the morning have u heard anything about the drug intuniv which is similar to qelbree,[]
qelbree,"Switching from a Stimulant because of having OCD too… Lots of intrusive thoughts here as well. Some suicidal ideations and zoning out into worse-case scenario thought-loops about loved ones.. Quite painful. It took a while to adjust to it and quiet down. It turns into white noise that clouds my focus sometimes. Which I suppose makes sense as to why Qelbree would fit in to the picture well. Sertraline is pretty activating for me, feels like an upper. I had a slight loss of appetite with it. 

Qelbree certainly kills the idea of appetite until I take the first bite, I'd say is a huge plus in comparison to Adderall killing appetite entirely. 

Libido did slightly decrease, but I was nympho as fuck before sertraline, Bup upped my sex drive, I wanted to fuck anything that moved. I did have issues with low sexual endurance which sertraline unironically boosted it.","switching from a stimulant because of having ocd too lots of intrusive thoughts here as well some suicidal ideations and zoning out into worse case scenario thought loops about loved ones quite painful it took a while to adjust to it and quiet down it turns into white noise that clouds my focus sometimes which i suppose makes sense as to why qelbree would fit in to the picture well sertraline is pretty activating for me feels like an upper i had a slight loss of appetite with it 

qelbree certainly kills the idea of appetite until i take the first bite id say is a huge plus in comparison to adderall killing appetite entirely 

libido did slightly decrease but i was nympho as fuck before sertraline bup upped my sex drive i wanted to fuck anything that moved i did have issues with low sexual endurance which sertraline unironically boosted it",[]
qelbree,"Switching from a Stimulant because of having OCD too… No experience with intuniv but Prozac wasn’t for me at all.
I take my whole med stack at dinner just in case it makes me a bit drowsy, because prior to vybriid, dinner was a few hours before a reasonable time to let the involuntary nap hit me lol","switching from a stimulant because of having ocd too no experience with intuniv but prozac wasnt for me at all
i take my whole med stack at dinner just in case it makes me a bit drowsy because prior to vybriid dinner was a few hours before a reasonable time to let the involuntary nap hit me lol",[]
qelbree,Switching from a Stimulant because of having OCD too… I’ve read Prozac & Zoloft are similar & both activating than the other SSRI’s. U think being a nymph came from the lower Dopamine in your system with the ADD or just always sexual??,switching from a stimulant because of having ocd too ive read prozac  zoloft are similar  both activating than the other ssris u think being a nymph came from the lower dopamine in your system with the add or just always sexual,[]
qelbree,"Switching from a Stimulant because of having OCD too… Oh wow, why don’t u take the Qelbree in the AM for energy?",switching from a stimulant because of having ocd too oh wow why dont u take the qelbree in the am for energy,[]
qelbree,"Switching from a Stimulant because of having OCD too… My sex drive stemmed from sexual trauma so the excess dopamine from Bup+THC upped my sex drive and caused me to be nymphomaniac. pre-Sertraline would hyper-fixate on bodily details for the purpose of sex, so sex is slightly less stimulating so it helps with endurance. I am currently moderating dosage as this can backfire in the long run. 

I've always had a high sex-drive though.","switching from a stimulant because of having ocd too my sex drive stemmed from sexual trauma so the excess dopamine from bupthc upped my sex drive and caused me to be nymphomaniac pre sertraline would hyper fixate on bodily details for the purpose of sex so sex is slightly less stimulating so it helps with endurance i am currently moderating dosage as this can backfire in the long run 

ive always had a high sex drive though",[]
qelbree,"Switching from a Stimulant because of having OCD too… No, I actually don’t notice it giving me any energy oddly. Definitely not as much/as noticeable energy as a stimulant medication. I think most people tend to feel sleepier than not on qelbree.
I actually don’t feel a need to drink caffeine on qelbree either. I’m usually just awake and calm/focused or I need a nap that can’t really be argued with lol","switching from a stimulant because of having ocd too no i actually dont notice it giving me any energy oddly definitely not as muchas noticeable energy as a stimulant medication i think most people tend to feel sleepier than not on qelbree
i actually dont feel a need to drink caffeine on qelbree either im usually just awake and calmfocused or i need a nap that cant really be argued with lol",[]
qelbree,Switching from a Stimulant because of having OCD too… What’s the difference between Hypersexual vs Nympho??,switching from a stimulant because of having ocd too whats the difference between hypersexual vs nympho,[]
qelbree,"Switching from a Stimulant because of having OCD too… They're kind of the same. Nympho is an old term for people that have no self-control when it comes to sex. Often the only thing that revolves around their mind is sex. Clouds cognitive function. Frequent sex

Hypersexual for me just means very high sex drive. Thinks about it very often. Frequent sex also.

Growing up I felt that nymphomania is a more serious condition than having hypersexual it.

Came to a point where all the thoughts I'd get is imagining every passerby without clothes imagining possibly with or without body hair. Couldn't answer simple questions Lmfao.","switching from a stimulant because of having ocd too theyre kind of the same nympho is an old term for people that have no self control when it comes to sex often the only thing that revolves around their mind is sex clouds cognitive function frequent sex

hypersexual for me just means very high sex drive thinks about it very often frequent sex also

growing up i felt that nymphomania is a more serious condition than having hypersexual it

came to a point where all the thoughts id get is imagining every passerby without clothes imagining possibly with or without body hair couldnt answer simple questions lmfao",[]
qelbree,Switching from a Stimulant because of having OCD too… I get that feeling when I see Hot Milfs lol,switching from a stimulant because of having ocd too i get that feeling when i see hot milfs lol,[]
qelbree,Switching from a Stimulant because of having OCD too… I got it when I see anyone with a remotely attractive feature on their body or face. Or pretty much when we lock eyes.,switching from a stimulant because of having ocd too i got it when i see anyone with a remotely attractive feature on their body or face or pretty much when we lock eyes,[]
qelbree,Menstrual cycle  I have only been on quellbre two three months but yes my periods too are weirder. I had two my second month in one month. I really like quellbre but I spent a lot of time getting my hormones and periods regular again so a little concerned,menstrual cycle  i have only been on quellbre two three months but yes my periods too are weirder i had two my second month in one month i really like quellbre but i spent a lot of time getting my hormones and periods regular again so a little concerned,[]
qelbree,Menstrual cycle  I'm in my second month of Quellbree and had a period 10 days ago and started again this morning. I have always been consistent with my periods. This is definitely unusual for me.,menstrual cycle  im in my second month of quellbree and had a period  days ago and started again this morning i have always been consistent with my periods this is definitely unusual for me,[]
qelbree,Menstrual cycle  This feels like a weird thing that might be secondary and not directly related. Has the medicine caused you to lose weight or impacted your appetite a lot?,menstrual cycle  this feels like a weird thing that might be secondary and not directly related has the medicine caused you to lose weight or impacted your appetite a lot,[]
qelbree,"Menstrual cycle  I do have a pcos diagnosis, which was already hard to get because I had fairly regular periods. I've lost weight on the medication, but not a significant amount. My period before, I might have a little hiccup in my menstruation, but it always went back to normal. But now that I've started this medication it's been consistently INconsistent",menstrual cycle  i do have a pcos diagnosis which was already hard to get because i had fairly regular periods ive lost weight on the medication but not a significant amount my period before i might have a little hiccup in my menstruation but it always went back to normal but now that ive started this medication its been consistently inconsistent,[]
qelbree,"This might be long. I've been on both, and I can tell you this... those 2 drugs are nothing like Adderall. Sure, they're stimulants, but they're non addicting. That being said. I enjoyed strattera more than qelbree. I took them because of my adhd. I'm also on wellbutrin 3x a day. The only reason why I stopped taking my adhd meds was because it made my bladder super sensitive, and I wasn't able to hold in my pee at all.
I would run to the restroom every 5-10 minutes to pee. It felt like a uti minus the burning.
Everyone has different side effects. I never got migraines with qelbree, but I've noticed it's very common on a high dose, though. I was only on 100mg.","this might be long ive been on both and i can tell you this those  drugs are nothing like adderall sure theyre stimulants but theyre non addicting that being said i enjoyed strattera more than qelbree i took them because of my adhd im also on wellbutrin x a day the only reason why i stopped taking my adhd meds was because it made my bladder super sensitive and i wasnt able to hold in my pee at all
i would run to the restroom every   minutes to pee it felt like a uti minus the burning
everyone has different side effects i never got migraines with qelbree but ive noticed its very common on a high dose though i was only on mg",[]
qelbree,"This might be long. I was taking Strattera for a while before I was taking Qelbree. I would describe it as helpful but not life changing. Oddly enough the reason I stopped was because it gave me woefully bad GI issues. Like heartburn, bloating and gas that was just continuous, which was weird because at the time I didn't see GI issues as common side effects. I even went to my general care practitioner to figure out what was going on, it was only after I stopped strattera that I realized it was the culprit.",this might be long i was taking strattera for a while before i was taking qelbree i would describe it as helpful but not life changing oddly enough the reason i stopped was because it gave me woefully bad gi issues like heartburn bloating and gas that was just continuous which was weird because at the time i didnt see gi issues as common side effects i even went to my general care practitioner to figure out what was going on it was only after i stopped strattera that i realized it was the culprit,[]
qelbree,"This might be long. I come from a background of dopamine addicts. Grandparents were either schizo or BP. Father is schizo. I'm BP2. 50mg sertraline, 25-50mg quetiapine(depending on how much mental activity on the day) Bupropion 300xl. Qelbree 200mg. I was also a coke fien

I found that Bup and Qelbree don't mix well for me as I crave nicotine bigtime under Qelbree. Personally feels like way too much norepinephrine(fight mode) high irritability and agitation. Impulsive speech, increased sensitivity to audible and visual stimuli, kinda had to dumb it down with earbuds or smoke some cannabis(med patient) or gummies.

Sertraline numbs my emotions while eliminating my public anxiety almost entirely but causes my impulsive speech from qelbree to feel more reckless. I find myself double checking if I said things correctly as I felt so incoherent.","this might be long i come from a background of dopamine addicts grandparents were either schizo or bp father is schizo im bp mg sertraline  mg quetiapinedepending on how much mental activity on the day bupropion xl qelbree mg i was also a coke fien

i found that bup and qelbree dont mix well for me as i crave nicotine bigtime under qelbree personally feels like way too much norepinephrinefight mode high irritability and agitation impulsive speech increased sensitivity to audible and visual stimuli kinda had to dumb it down with earbuds or smoke some cannabismed patient or gummies

sertraline numbs my emotions while eliminating my public anxiety almost entirely but causes my impulsive speech from qelbree to feel more reckless i find myself double checking if i said things correctly as i felt so incoherent",[]
qelbree,"This might be long. I had so many bladder issues with wellbutrin!!! From other threads I’ve read, it’s very common, especially at higher doses. I never would’ve known & am so pissed I really missed 6 months of my life bc of it.",this might be long i had so many bladder issues with wellbutrin from other threads ive read its very common especially at higher doses i never wouldve known  am so pissed i really missed  months of my life bc of it,[]
qelbree,"This might be long. Yeah, I’ve read qelbree is not good for ppl w BP. Likely to have opposite of calming effect, & is more like, overstimulating & likely to induce mania. I feel the same exact thing w the nicotine!! Also felt agitated, like I wanted to go sprint but had zero energy to get out of the bed. It sucks, bc it actually does wake me up. I went down from 200mg to 100mg yesterday. Really hoping it’s better this way.",this might be long yeah ive read qelbree is not good for ppl w bp likely to have opposite of calming effect  is more like overstimulating  likely to induce mania i feel the same exact thing w the nicotine also felt agitated like i wanted to go sprint but had zero energy to get out of the bed it sucks bc it actually does wake me up i went down from mg to mg yesterday really hoping its better this way,[]
qelbree,"This might be long. I also had bladder issues when taking just auvelity & adderall. Hard to tell if the issues were from some of the adderall generics or auvelity (bupropion & dxm). I went to the doctor for uti so many times, & they said there were trace amounts of blood in my urine (indicating inflammation), but there was no uti. 

That time I was on bupropion in comment above, they diagnosed me with interstitial cystitis. Made me feel crazy, like what I was feeling wasn’t real. 

Also, if you ever take ketamine for depression, that has the same effect. 

Boric acid suppositories are actually the most amazing miracle worker.","this might be long i also had bladder issues when taking just auvelity  adderall hard to tell if the issues were from some of the adderall generics or auvelity bupropion  dxm i went to the doctor for uti so many times  they said there were trace amounts of blood in my urine indicating inflammation but there was no uti 

that time i was on bupropion in comment above they diagnosed me with interstitial cystitis made me feel crazy like what i was feeling wasnt real 

also if you ever take ketamine for depression that has the same effect 

boric acid suppositories are actually the most amazing miracle worker",[]
qelbree,"This might be long. I've been on wellbutrin for about 2-3 years and I didn't have any side effects which is why I stuck with it because any other antidepressant gave me insane side effects like effexor gave me vivid dreams to the point that I didn't know if my waking life was a dream or not. Wellbutrin does have a bit of stimulant but not enough to trigger bladder problems but Jesus christ strattera and qelbree would not let me hold my pee in.
I work at 7/11 and I kinda sorta peed myself. It's embarrassing. 
And you know what's funny, I take Picot for my acid reflux and when I'm having bladder problems, it calms it down. I think it has boric acid as well.","this might be long ive been on wellbutrin for about   years and i didnt have any side effects which is why i stuck with it because any other antidepressant gave me insane side effects like effexor gave me vivid dreams to the point that i didnt know if my waking life was a dream or not wellbutrin does have a bit of stimulant but not enough to trigger bladder problems but jesus christ strattera and qelbree would not let me hold my pee in
i work at  and i kinda sorta peed myself its embarrassing 
and you know whats funny i take picot for my acid reflux and when im having bladder problems it calms it down i think it has boric acid as well",[]
qelbree,"Be so careful if you stop taking this medication. Tapered or abrupt. I had to taper off of Qelbree while trying to to get pregnant, and 2nd day after my last dose, I also had a migraine so bad I spent the day puking up bile and had to take a day off work. Luckily no hospital visit, and felt much better the next day (still had a migraine but no associated nausea). Headache totally gone after a few days. 

It helps so much with my productivity, circadian rhythm, and impulse control that I plan to get back on it as soon as I'm done with breastfeeding, if I can find a pharmacy that will fill it (the biggest issue for me). Even though the withdrawal suuuuuuuucks. It's worth it to me.

As nasty as the withdrawal side effects are, they are way way better (and shorter-lived) than tapering off of duloxetine, which was no joke the worst experience of my life.","be so careful if you stop taking this medication tapered or abrupt i had to taper off of qelbree while trying to to get pregnant and nd day after my last dose i also had a migraine so bad i spent the day puking up bile and had to take a day off work luckily no hospital visit and felt much better the next day still had a migraine but no associated nausea headache totally gone after a few days 

it helps so much with my productivity circadian rhythm and impulse control that i plan to get back on it as soon as im done with breastfeeding if i can find a pharmacy that will fill it the biggest issue for me even though the withdrawal suuuuuuuucks its worth it to me

as nasty as the withdrawal side effects are they are way way better and shorter lived than tapering off of duloxetine which was no joke the worst experience of my life",[]
qelbree,"Be so careful if you stop taking this medication. Tapered or abrupt. I strongly encourage you to share your experience in a comment on the pinned comment at the top of the sub!  I put it there to help people know ahead so that it doesn’t happen, and the more input on it the better!",be so careful if you stop taking this medication tapered or abrupt i strongly encourage you to share your experience in a comment on the pinned comment at the top of the sub  i put it there to help people know ahead so that it doesnt happen and the more input on it the better,[]
qelbree,Be so careful if you stop taking this medication. Tapered or abrupt. I have forgotten to take it for more than one day and never had anything like this happen at all. I guess some people are more sensitive than others.,be so careful if you stop taking this medication tapered or abrupt i have forgotten to take it for more than one day and never had anything like this happen at all i guess some people are more sensitive than others,[]
qelbree,"Be so careful if you stop taking this medication. Tapered or abrupt. Yeah, I unfortunately found out about the headaches from my doctor accidentally writing my prescription for the wrong quantity and having to wait until Monday to get more. After missing both weekend doses, I woke up at about 12:30am Monday out of a dead sleep with the worst headache I’ve ever had (and I have had migraines and post-concussion headaches many times) and severe nausea that resulted in a trip to the emergency room. Crazy how the manufacturer doesn’t really list those effects of discontinuation anywhere.",be so careful if you stop taking this medication tapered or abrupt yeah i unfortunately found out about the headaches from my doctor accidentally writing my prescription for the wrong quantity and having to wait until monday to get more after missing both weekend doses i woke up at about am monday out of a dead sleep with the worst headache ive ever had and i have had migraines and post concussion headaches many times and severe nausea that resulted in a trip to the emergency room crazy how the manufacturer doesnt really list those effects of discontinuation anywhere,[]
qelbree,"Be so careful if you stop taking this medication. Tapered or abrupt. I'm so sorry that happened to you. THIS is why I stopped taking it. I had forgotten to take it one morning after leaving for work, and I had the worst migraine and nausea in my life. It felt worse than a hangover. No other drug has ever done this to me before. The medication does work but has terrible consequences. It took me one week to adjust back to the medication after missing that ONE dose..I told my doctor I don't feel comfortable taking this anymore so she put me back on Adderall.",be so careful if you stop taking this medication tapered or abrupt im so sorry that happened to you this is why i stopped taking it i had forgotten to take it one morning after leaving for work and i had the worst migraine and nausea in my life it felt worse than a hangover no other drug has ever done this to me before the medication does work but has terrible consequences it took me one week to adjust back to the medication after missing that one dosei told my doctor i dont feel comfortable taking this anymore so she put me back on adderall,[]
qelbree,"Be so careful if you stop taking this medication. Tapered or abrupt. I've had experience with many different drugs and had to withdraw from a few. I am tapering off from 400 mg. 2 weeks ago the pharmacy couldn't get it for 4 days and it was the single most frightening painful and anxiety ridden event I have had in 30 years. it is hard to believe that there is no better warning as to the side effects of withdrawal. I would not wish it on anybody, I understand why one would end up in the hospital because I almost ended up there myself.",be so careful if you stop taking this medication tapered or abrupt ive had experience with many different drugs and had to withdraw from a few i am tapering off from  mg  weeks ago the pharmacy couldnt get it for  days and it was the single most frightening painful and anxiety ridden event i have had in  years it is hard to believe that there is no better warning as to the side effects of withdrawal i would not wish it on anybody i understand why one would end up in the hospital because i almost ended up there myself,[]
