Drug Name,Condition,Review Text
dexedrine,For ADHD,"For ADHD""I have taken pretty much every type of medication for ADHD. Dextroamphetamine, by far, works best for me. While Adderall contains dextroamphetamine, the l-amphetamine, and it gives me very bad anxiety. Dextroamphetamine helps me focus without causing extra anxiety, and I prefer the instant release, which allows me to fall asleep. Ritalin caused anxiety even worse than Adderall did. One thing I recommend is to take a day or two off every week or so. If not, your tolerance might build up, and you might find the medication is not working. Also, you need to learn to pay attention to your body's other signals telling you when to eat. You probably will not feel hungry, and your stomach. This does not mean you don't need food, however."""
dexedrine,For Narcolepsy,"For Narcolepsy""Hopefully my experience will give some with narcolepsy a little bit of relief taking this medicine. I started taking Dexedrine when I was 31 years old and 100 tablets of Dexedrine cost $5. I am now 71 years old and have been taking this for 40 years and I am still alive without any bad side effects that I am aware of. After taking Dexedrine, I finished nursing school and became an RN. Since that time, I have retired. As a teenager in high school, I thought that studying was going to my bed with a book and falling asleep. If it wasn't for a clerical course, I would have never graduated as I couldn't fall asleep typing or taking shorthand. I was amazed how Dexedrine helped me. My dose is 2 10 mg tablets 3 times a day."""
dexedrine,For ADHD,"For ADHD""I'm 46 and was diagnosed with ADHD 2 times when I was a kid but never took the medicine. My life's always felt out of control and an emotional roller coaster. I tried Adderall first, but it made me too jumpy. I switched to Dextroamphetamine, and once I got past the first week and up to my 20 mg a day, everything became so much easier to deal with in life. Less stress, better sleep at night, and makes me feel 'normal'. Best medicine in the world, but the cost is absolutely ridiculous as I have no insurance."""
dexedrine,For ADHD,"For ADHD""I would suggest anyone on this, to stop or take a break once you've noticed your reasoning, memory recall abilities becoming hindered. Even though I'm happy with the benefits of focus, it's not worth losing your short-term memory. Over time, I noticed my math skills declined, followed by my word recall, spelling, and now I can't remember stories or study material. It's extremely debilitating, I'm trying to figure out how to reverse the side effects."""
dexedrine,Unknown Condition,"""This drug is incredible. Without this drug, I would not be able to work 45 hours a week. I went on a leave of absence until I got 20 mg. I crave sleep almost all the time when not on this drug. On the Dex, I can get up and get to work. It increases my energy level 3 out of 10. So a 4/10 becomes a 7/10. Which is my max (ok, rarely an 8). I have 1/10 days, usually 2 to 3 days a month, so I skip taking the Dex and sleep 15 hours. I shall add I get zero side effects, so I am very fortunate. The Dex is not a miracle, but it allows me to make $$ for my family. I enjoy working, and I also enjoy some free time. Without it, frankly, my life would be a disaster."""
dexedrine,For ADHD,"For ADHD""My son is now 9. Since 4 years old, we have tried every single (literally!) ADHD medication on the market, and every single (literally!) medication was never without any serious side effects. My son's specialist suggested Dexedrine as the very last alternative before trying antidepressants. I was hopelessly optimistic, but this medication is truly a gift. I don't know how else to describe it other than being 'smooth' and without it I don't know what we would do. His specialist basically said this medicine is a more pure form of amphetamine than the other name brands on the market. If you have tried medicine after medicine... give this a try. It has saved my son and our family."""
dexedrine,For ADHD,"For ADHD""Been on Vyvanse for 3 years, Adderall XL, & Adderall for another 3 years with limited success. I take a lot of other medications for mania & am always tired in addition to lacking focus... for the first time in years, I can watch a movie, read a book, make it through multitasking a workday. Maybe this is what normal is meant to feel like—a world without yawns and easy distractions? Have I truly found a way to make it through a two-hour movie? I think a new chapter in my life just opened..."""
dexedrine,For ADHD,"For ADHD""I was diagnosed with ADHD six months ago. I am 30 years old. My whole life has been a big problem with taking school, finance, and friendship seriously. I have, on the other hand, been a person with a good mood, charm, and a sense of adventure. All these are good qualities you think? Not really. I've developed alcoholism, I've never had a financial surplus, I've lost touch with most of my good friends, and I've never accomplished anything I've set myself the goal of. I began to understand why my life has become so miserable. I started exposing myself to all kinds of things - for the first time I felt solid - a sense of integrity. At the same time, it was a great stress. After a month, I began to think that my whole life had just been a big joke. Before you start taking this medicine: Be prepared to experience identity disorder. NEGATIVE: My hair has gone from thick to thin, my skin is not so smooth anymore, and sometimes sleep can be very difficult."""
dexedrine,For ADHD,"For ADHD""Adderall 30mg/day = you feel like a genius, work hard, EYES OPEN WIDE. But at the end of the work day, I still couldn't stop myself from falling asleep on the skytrain at around 4:30 pm when I try to read. Don't think it helped much with depression and anxiety. Dexedrine 3 10mg/day = You have tunnel vision, Focused, block out distractions, helps with my severe anxiety. I think the depression is pretty under control too. Can read all day if I want. Could have really used this when I began my studies, 4 years ago! Not a month ago, with one course.... Either one, I think you perform better at work and school, but Adderall just wore off, so studying after work, you would still need coffee, or a power nap"""
dexedrine,For ADHD,"For ADHD""I have no official diagnosis yet. I don't remember ever feeling so at peace. My mind is still. I can breathe for the first time. I relax like never before. A wee bit sleepy. This will make me a better, much happier person instead of who I was: someone who was always racing around in circles, chasing my tail."""
dexedrine,For ADHD,"For ADHD""So I started Zoloft in my 20s, it worked really great for a couple of years. So when I got any depression flare-ups again, I was put on antidepressants, but noticed they weren’t working anymore. I still feel those symptoms: sadness, low self-esteem, no energy to do anything, forgetting things, procrastinating a lot, hard to concentrate and finish a task. I wondered if I had ADD. It all pointed to Adult ADD. I told my doc of my beliefs and maybe I was misdiagnosed. I tried more antidepressants which were having no effect. Then my therapist convinced my doctor to prescribe me Dexedrine 10mg just in the morning. The first day I took my pill, my eyes were open, the energy was there, and I couldn’t believe it worked. Now, on the 3rd day with just one 10mg pill in the morning, it stopped working. In my opinion, I believe a lot of people are misdiagnosed, thinking they have depression instead of ADD or ADHD."""
dexedrine,For ADHD,"For ADHD""The very best ADHD medicine I’ve tried! I started out on methylphenidate, which did absolutely nothing for me, then switched to Adderall, which worked but caused me anxiety quite often. After being on Adderall for a while, I did my own research and came across Dexedrine/dextroamphetamine and how tons of people who struggled with anxiety on other ADHD meds loved it. I asked my doctor to switch, and I am so thankful that I did!! With Dexedrine, I don’t feel anxious or jittery, but have tons of drive and focus to get things done! I have to point out, for those of you who like Adderall and the “speedy“ feeling you get from it, then Dexedrine may not be for you. However, if you are like me and don’t like feeling like you’ve taken a narcotic stimulant, then you should certainly try Dexedrine/dextroamphetamine… You won’t regret it!! It feels far more natural for me personally than Adderall ever did. I am so thankful for this medication!"""
dexedrine,For ADHD,"For ADHD""Have been taking Dexedrine spansules (10 mg) for over 2 years, three times per day. I never knew I had rank ADHD all my life - problems with school, the law. I am 47 and have noticed my ambition for life has increased, having more energy. I used to be tired a lot, complaining, generally overall agitated. At the same time, I have many comorbidities to deal with but fortunately don't have to take any anxiety meds. Dexedrine is all I know, and I am satisfied with the results."""
dexedrine,For ADHD,"For ADHD""Have been on dextroamphetamine for a very long time for ADHD. Started with the name brand but switched to generic due to costs. Generics appear to vary widely. Neither Teva nor Aurobindo work for me at all. Worthless for me. Mallinckrodt works, as does the brand name, but I can't access Mallinckrodt. Someone has suggested Zenzedi (tablet, not capsule). It is a generic-simply named. Anyone have any experience with it? Anyone have a similar experience with Teva or Aurobindo? Either the inactive ingredients are sufficiently different to cause problems for me, or they don't include the same dosage of the active ingredient. Anyone know which? Dexedrine itself has made a huge difference in my life."""
dexedrine,For ADHD,"For ADHD""No buzz, no crash, just adds the focus I need to overcome my ADD (not hyperactive) and get things done. I don't need to have the gun of a deadline on my head to start and complete quality work. I always knew I had good intellectual potential, but I was diffuse like a lens out of focus. This enables me to deliver my full measure since 2010. My MD had me trial Vyvanse, Ritalin, Adderall, and Dexedrine. While all helped me with ADD symptoms, Dexedrine is the one that does not have any detrimental side effects and feels the cleanest (does not change my behavior, my head feels normal but focused). I also like the possibility of getting 'off' the medication if I don't have anything important in the afternoon, I just will not take the noon pill. It also helped me keep my tolerance down over the years. I am still at 5 mg twice a day. My BP is 120/80, I am physically active at 50 years old. All men starting stimulant meds: check your hair and get appropriate preventative hair loss treatment EARLY!"""
dexedrine,For ADHD,"For ADHD""After 38 years of thinking my brain was broken, I finally have found relief for the constant overthinking, anxiety, and racing thoughts. My whole life I’ve been an anxious person but still managed to do well in school and become a medical professional. It never occurred to me or my family that I was suffering from severe hyperactivity. I was constantly restless, had chronic insomnia, and was obsessed about food. I always assumed I just had an anxiety disorder and didn’t know how to shut my brain off. I had tried SSRIs, Xanax, supplements. Nothing seemed to work and usually just made me feel worse. It wasn’t until I tried Wellbutrin and passed out for 8 hours that my treating doctor suspected I might have ADHD. I was given an evaluation and took my first stimulant (Adderall) and behold, I fell asleep within 30 minutes. Adderall made me too foggy and tired, Ritalin made me tired and had heart palpitations, but Dexedrine has been quite literally perfect. It’s changed my life."""
dexedrine,For ADHD,"For ADHD""I wouldn't use any other type of ADHD medication! Adderall & many of the newer ADHD medications cause agitation & symptoms that make my condition worse. If I didn't use Dexedrine, I wouldn't take medication to treat my ADHD! More people need to educate themselves on how to treat ADHD."""
dexedrine,For ADHD,"For ADHD""I am 20 and was only diagnosed with ADHD about 6 months ago. I tried Ritalin first and it did nothing for me, but then I was prescribed Dexedrine and it has been a lifesaver. There's definitely some odd but kind of fun side effects for me. I get extremely into whatever I'm doing, which is super helpful for school, but sometimes a bit awkward in social situations because I enjoy conversation a little too much and worry that I annoy people. It makes me really ambitious and I feel the need to learn/accomplish things while I'm on it, but not physical things unfortunately, like working out or cleaning, haha. I usually start doing homework, planning things, or doing research. It's going to help me succeed in school so much more now."""
dexedrine,For ADHD,"For ADHD""Tried Adderall, Ritalin, etc. Since I have co-morbid anxiety, they made me 'tweak'. Very anxiety-provoking. Dexedrine, however, proved to be the exception. Its feel is more relaxed and focused. I take less of my Klonopin and Xanax because of the feeling of control and the ability to finish tasks. I am glad I researched and suggested it to my doctor, who by the way now is a believer in Dexedrine for patients who do not respond to Adderall and Ritalin."""
dexedrine,For ADHD,"For ADHD""Treatment for ADHD saved my life. Don't believe all the hype and the stigma around this diagnosis and treatment. It is a real condition, there is real treatment, and it makes a real and profound difference to the lives of people with this debilitating condition. So don't be afraid to seek help if you think you might have ADHD. It is not just a childhood illness, in my opinion, it generally persists in some form for the duration of your life just like any other disease."""
dexedrine,For ADHD,"For ADHD""Dexedrine is a superb medication for controlling ADHD impulsivity. It's a 100% smooth and clean ride compared to Adderall. Unfortunately for me though, I lack motivation, so Adderall is a better choice for me. I did rate this based on symptom control. If Dexedrine motivated like Adderall does, it would literally be the perfect medication. Pros: Superior focus, reduced impulsive decisions the best. Side effects are minimal compared to Adderall. Cons: Lacks motivational kick that Adderall delivers. Only comes in 5mg, 10mg, & 15mg capsules and is expensive."""
dexedrine,For Narcolepsy,"For Narcolepsy""I was diagnosed with narcolepsy at the age of eight. I was taking a 5 mg tablet that handled my situation. I was able to be an outgoing, loving child. My body was managing medication without falling asleep at inappropriate times. I am now over 70, now taking 15 mg span one twice a day. I am able to function and maintain a high-profile professional position. The very worst part of this medication is the price. My parents were paying $5.00 for my medication. After marriage, I was paying a $15 co-pay, then went to a $35 co-pay, and now it’s $144. I think this is totally unfair and a ridiculous charge for this drug. However, I don’t have a choice because it works. I have taken other medications that caused hallucinations, inability to drive, heart palpitations, and feeling like I was on a high all the time, however, Dexedrine does not create a problem, not in the slightest. I do not experience dry mouth, jitters, hallucinations, heart palpitations, or any side effects with Dexedrine."""
dexedrine,For ADHD,"For ADHD""I have used it for over 15 years. An EEG showed I had quite a bit of extraneous thoughts, a left and right hemisphere that had identical thought processes, and a temporal lobe that was off the chart. Dexedrine changed my life. Unfortunately, many doctors are using outdated or outmoded technology and refuse to prescribe it."""
dexedrine,For ADHD,"For ADHD""This worked from the very second I started on it 5 years ago; Helped me focus like never before, although being someone with OCD who noticed most things anyway, this magnified it 10-fold. Gave a reserve of energy that helped even when tired. Only side effects were that you build up a tolerance rather quickly when it comes to the original effect, I began to grind my teeth as I slept, and had the worst dry mouth ever...could drink a gallon of water in 2 minutes and still have the driest mouth ever. Would recommend."""
dexedrine,For ADHD,"For ADHD""This was one of many I tried. I was more satisfied with this one than any of the others. I never had headaches (with some I had terrible headaches!) The time release worked very well. Overall, I rate this medicine the best in its category."""
dexedrine,For ADHD,"For ADHD""I have been taking Dexedrine for about seven days now, and it has definitely helped with my chronic feelings of anxiety - that painful feeling in your chest. This, in turn, has allowed me to concentrate better on the daily issues at hand rather than constantly having that feeling of fight or flight regarding any number of daily life issues. Thus far, very helpful, and I hope to continue down this path - I wish I had tried this drug years ago."""
dexedrine,For ADHD,"For ADHD""Dexedrine is simply a miracle. Ever since I was young, I felt distant from everyone around me, and I felt as though I was always in my own world. My grades at school really started to suffer once I reached high school because of my undiagnosed ADHD. Homework and projects seemed impossible because I could not concentrate. Now, after being diagnosed with adult ADHD, I am on Dexedrine XL 15mg and Dexedrine SR 5mg. With this medication, I am doing very well in my university studies. My mind is clutter-free, and I can actually focus on the task at hand! It's simply great! Dexedrine also works great for giving me tons of energy, especially when I need it for work and night school."""
dexedrine,For ADHD,"For ADHD""I'm a 32-year-old girl who has been diagnosed with mood disorder spectrum, which includes bipolar II, generalized anxiety/panic disorders, and social phobia disorder. I've been treated for them separately for 15 years with every psych medicine out there. I haven't been feeling right for a while. I went off medicines during my two pregnancies in the last 3 years. Recently, I saw a new doctor who told me about my mood disorder spectrum, but he also said I had a severe case of ADD, which I had never been diagnosed with before. My insurance would only pay for Dexedrine. By my second dose, I felt like a new person! I was scared the stimulants would make my anxiety worse, but it really makes me calmer and focused. My friends noticed after the first day that I was feeling better. It's the best thing since Xanax!"""
dexedrine,For ADHD,"For ADHD""I have been on Dexedrine XR 2 15mg in the morning for 19 years, and I don't know what I would do without it. When I go a day without it, I just can't seem to get my everyday living done. I feel scatter-brained, my thoughts don't make sense sometimes, and I feel like my brain can't keep up with itself, and that is no way to live. I'm so thankful for this medicine because without it, I don't know where I would be in life."""
dexedrine,For Narcolepsy,"For Narcolepsy""Have been taking Dexedrine from the days of SKF, and before. Now in my seventies, a different pharmacist gave me a generic version from Activa Co., which seemed to have no proper drug in it. I mostly felt cheated because there was no helpful effect. I felt lousy and slept away 3 months of my life, having no energy. I could not function normally as before. I called my pharmacist to report the medication was not working, and the spansules weren't even the same color or size. He said they are a cheaper brand. I told him I don't mind paying more for the proper medication I have taken daily for more than 50 years. I refuse to be abused in this way, and will take my next script back to my previous family pharmacist."""
dexedrine,For Narcolepsy,"For Narcolepsy""I've been taking Dexedrine spansules 15 mg, 2 pills at a time, 2-3 times a day for about 30 years for narcolepsy. I'm currently 57 years old. If it weren't for this Rx, I would probably never leave my house. Through the years, I have tried various alternative meds only to find they don't work as well. Among the alternatives tried are Adderall (made me actually violent); Provigil (absolutely ineffective); and Nuvigil was worse than ineffective...because it gave me the sensation of being high. So I thought it was working and I got behind the wheel of a car...bad idea. Changed back ASAP. Been on the same dosage for 20 years. Side effects: for 10 minutes every day, I get a bad dry mouth and feel anxious. Cost is prohibitive."""
dexedrine,For ADHD,"For ADHD""I absolutely love Dexedrine! It doesn't give me the crash that Adderall has, and it really keeps me focused on the tasks at hand. I was able to thoroughly apply for a gig and landed it, and I wonder if I would have on the alternatives. I hear they're trying to rid Dexedrine to switch over to Vyvanse, but since that drug has no generic and the two are about 99% similar, I'm guessing it is more for profit reasoning. I'm telling everyone to switch over, you won't regret it. 1 15mg er/day should be the max for those considering switching. I read somewhere on here a doctor prescribed about 100mg, which is too much and the reasoning for your manic state. Go for trusted generic brands like Sandoz and Mallinckrodt. Teva is the worst."""
dexedrine,For ADHD,"For ADHD""I was on two 15 mg spanuals a day. I felt great when I began taking them. Way more focused, not just at home but at school too. My grades had improved tremendously. I had absolutely no troubles with this medication. I was taking Dexedrine for a little over 10 years. Due to my other meds I now take, I'm unable to continue to take Dexedrine. I would recommend Dexedrine to an adult or child."""
dexedrine,For ADHD,"For ADHD""This medication is very good. I take it first thing in the morning, 2 capsules of 10 mg and one around noon. In exactly one hour, I feel that hit, dopamine increasing in my brain, me being able to focus on everything and multitask at one time. I was just diagnosed with ADHD. Before Dexedrine, I just could not concentrate on anything, it was so, so bad. But I can't explain in words the FLASH or hit you feel after one hour, it is tremendous. I feel so happy, everything I see, I see with happy eyes. Besides all the positive facts I mentioned, I really have to say it has severe side effects. The first day I took only a 10 mg capsule, after a few hours that it kicks off, I had an anxiety attack like I have never had in my life. I felt like my chest was going to explode, that feeling was so strong that I had to take Xanax. Besides that, I have problems falling asleep, some nights I don't even sleep at all. As well, my hands start shaking, and I feel disturbed and nervous."""
dexedrine,For ADHD,"For ADHD""I have found that Dextroamphetamine ER cap (AKA Dexedrine spansules) are best for treating my ADHD. I have tried Ritalin and Adderall, and both came with bad side effects. Ritalin made me feel like a zombie, and Adderall had sexual and hypertension side effects. The switch to Dextroamphetamine has increased my focus, alleviated my ADHD symptoms, and also increased my sex drive. I used to take 10mg x 4 Adderall, but I find that 10mg x 2 Dexedrine ER works better for me. So I was able to decrease my intake of amphetamine while switching to Dexedrine. After half a year, I have found no negative side effects whatsoever."""
dexedrine,For ADHD,"For ADHD""I've been struggling with emotional/social numbness, lack of focus or drive, an intense caffeine addiction, procrastination, apathy, depression, an inability to improve my life, binge-eating, self-loathing, and even the seedlings of alcoholism, all connected to my severe ADHD. Been on a very high amount of Dexedrine for a couple of months now, and my life is completely different. My self-confidence skyrocketed, I'm able to go to a very drunk people-infested mosh pit and not have to get drunk to have a blast, I'm doing the most work I ever have, I'm focused and driven, I'm organized, I'm eating healthy, I'm realizing my worth and making breakthroughs about myself, and I'm ten times more empathetic and able to support my family and friends and girlfriend more than ever. This stuff truly changed my life. The only negatives are that I still have a caffeine addiction, which has given me very, very intense panic attacks. Also, insomnia. But nonetheless, I'd say 9.6/10."""
dexedrine,For ADHD,"For ADHD""I'm 38. I've been taking Dexedrine now for my fourth time for a month. I was diagnosed at 21 in 1995. I tried Ritalin for a couple of weeks and stopped. I went untreated for a few more years. I went to my doctor about my wild mood swings and EXTREME emotions and told him about Ritalin. He said I should try Dexedrine. Instantly, it did wonders. If a coworker said something that would have offended me and got me bent out of shape, it just rolled off my back. I felt great and inspired. It didn't affect my sex drive at all."""
