Drug Name,Condition,Review Text
ritalin,For ADHD,"For ADHD""I'm a 20-year-old woman, 179 cm and 61 kg, who just got diagnosed with ADD for the first time in my life, after living with it untreated for so many years. So, my doctor wanted to prescribe me Ritalin, though in small doses, so I didn't just go all in from the start. I started with 10 mg, which didn't have an effect. Then I took 20 mg, I felt a little more energized, but nothing else. Then I tried 30 mg today. I felt extremely fresh in my mind, instead of the weird slump I'm usually in. Very happy, which suggests that what I lacked before was dopamine. Still no difference with anything else, like my poor concentration and focus, but on the other side, there are no side effects as of late. Other than the things that I've already struggled with, like depression and anxiety. Not a bad experience thus far, but I'm still a little bit nervous about how 40 mg and 50 mg will affect me."""
ritalin,For ADHD,"For ADHD""I have severe ADHD. For a while, I didn't know what was wrong with me, constantly daydreaming, lazy, unorganized, acting impulsively, and very hyper. The medicine has changed my life. All these symptoms are gone, except I'm still a bit hyper and impulsive, but only slightly. It does exactly what it says on the tin and changed my life dramatically. I could actually focus. Bad things would be if you are sensitive to stimulants like coffee. It will make you jittery, it gives you a slight mood and energy boost. I'd recommend taking it in small doses first."""
ritalin,For ADHD,"For ADHD""Racing heart and head rushes when you first start taking the medicine. It was my lifesaver for high school and college and even now through life. I can actually accomplish things in an orderly fashion."""
ritalin,For ADHD,"For ADHD""I started Ritalin 10 mg 3 times daily yesterday, as I have ADHD. I feel calmer and less anxious, but it is not a huge difference. I also seem to be in a more positive mood, and getting myself motivated to do things seems easier, but that could just be the placebo effect at work. The first thing I did when the first dose kicked in was have a nap, so it must be calming me down. I expected my Tourette's or anxiety to get worse, but I haven't noticed any side effects so far."""
ritalin,For ADHD,"For ADHD""Ritalin is great. I've been taking it for 6 months now after being diagnosed with ADHD. Now I can focus on my schoolwork and stay alert when last year I was sleeping the whole day during school and could learn anything. Marks, of course, have jumped from C to A as I can focus and stop doing stupid mistakes in tests that I didn't realize I was doing nor could spot due to the lack of patience. Impulses have been reduced also."""
ritalin,For ADHD,"For ADHD""Works very well in the beginning. After a couple of months, induces tolerance. Anyway, it changed my professional and personal lifestyles. Now I pity the person I was. I never experienced a linear and practical thought until I used this."""
ritalin,For ADHD,"For ADHD""I've been on this medicine for about a month and lost around eleven pounds. I initially got on it to stay more focused in school, although I don't have a serious case of ADD, but I don't mind the weight loss. I could spare a few pounds. You get a rush for about 45 minutes after it kicks in, and that feels better than it should. I feel I can concentrate when I use it, but I'm not myself when I take it. My personality is dulled a bit, and even if I have homework to do, I'll find something to distract myself. Whether it's choosing a simpler assignment or just writing because I still feel like I'm being productive."""
ritalin,For ADHD,"For ADHD""Ritalin has changed my life for the better. Family and friends could see how happy I was. I was able to finish what I started instead of 20 projects. A fill-in doctor said he would not prescribe me my Ritalin because I was 61 years old, that I was too old. My regular doctor is out of town. I am withdrawing and very tired and depressed, and I want to die, or I will if. These thoughts of the afterlife will be painless, live alone, and no one will find me for days."""
ritalin,For ADHD,"For ADHD""What can I say, dx with mild ADD too (who isn't anymore). But this, taken with Effexor XR, has helped very much with apathy, motivation, energy, and enjoyment of life! Drs. reluctantly Rx this because it is a Schedule II substance and is mostly Rx'd for ADD/ADHD, but it has a profound effect in boosting the effects of an antidepressant. Taken alone for depression? Not really a good idea because it wears off fast. I take 20-30 mg a day (TID)."""
ritalin,For ADHD,"For ADHD""Diagnosed at 33 when I was finally able to find the right psychiatrist, I was prescribed generic Ritalin, and it quite literally changed my life. It was a bit of a journey to find the right formulation and dose. I take this form of short-acting Ritalin after the Ritalin LA wears off (usually 6-7 hours). Pros: Works quickly, cheap, well-known and researched, relatively easy to obtain (not as much of a shortage as other more 'fancy' formulations), and works for a large population of people with ADHD. Cons: Wears off quickly (sometimes 2 hrs for me), feels like a bumpy ride of ups and downs, hard to remember to take on time. Drink lots of water, make sure you graze on high-protein snacks to avoid getting hangry, take a shower, and get up and do something. I get sucked into 'the zone' if I take my meds and then come online... for example :) Good luck to you in finding your best self!"""
ritalin,For ADHD,"For ADHD""Well, my experience with Ritalin really changed my life, and I really mean really. This medication has a lot of pros as well as cons. Without Ritalin, I could not do anything in school, I was literally paralyzed. Everyone did better than me, but I tried the hardest, and I just couldn't do it, there was no way. So, when I got Ritalin, it made a huge impact on my life, I mean huge. This substance really changed me, the way I acted, the way I thought. It was amazing, I fell in love with it. I took the proper amount every time: 40 MG - 60 MG. Now, I have been taking Ritalin for 7 years. The only cons are it makes you very still after a while, and depression, but I can deal with it."""
ritalin,For Narcolepsy,"For Narcolepsy""I really like it. The only thing about the Ritalin is that you get a slight rush, and then it seems to wear off before it should. My dosage was doubled, and that seemed to work out a lot better. It truly does the job, as I don't fall asleep all the time."""
ritalin,For ADHD,"For ADHD""I had taken every form of Ritalin while in elementary and junior high school. It helped me focus, but I felt like a zombie, and my mom always felt like it was not really me. I was always angry when I would start to come down from it at night, so in high school, I started taking Adderall, and it was such a great change."""
ritalin,For ADHD,"For ADHD""Have to say wow! It helps low energy, depression, and works well with most SSRIs and some low-dose SNRIs. Life feels exciting again, and it offsets SSRI sexual side effects. Works fast and well. The main problem is that it wears off in a few hours, so you need to dose multiple times a day. It causes you to sweat a little more and be a little more irritable than usual, but it is really a great med to help depression. It is much different and better than Wellbutrin for sure, even though both are NDRIs. Check out the research on stimulants for depression and bipolar depression. Going to try Provigil now for a more even energy/mood boost. But I may be back to this."""
ritalin,Unknown Condition,"""I suffer from anxiety and depression, and while antidepressants worked, I still didn’t have any motivation or drive. My doctor wanted me to try taking Ritalin in addition to my regular medication. For me, it made a huge difference, life-changing. I’m a 44-year-old female, and I haven’t felt this good since before I was diagnosed with depression and anxiety. I take 10 mg of short-acting twice a day and usually don’t need it on weekends. I’m so thankful this worked for me."""
ritalin,For ADHD,"For ADHD""I was diagnosed with fibromyalgia. It seems I also have ADHD, idiopathic hypersomnia (not narcolepsy, but an unknown reason for excessive sleepiness), and a host of other symptoms. Ritalin was a lifesaver. I am able to think clearly again, I can wake up in the morning, and stay awake during the day, and my creativity is back (artist/crafter). It seems my tolerance is building, so my doctor tried me on LA; in a 1-month test I had a rocky start, but once my system adjusted, it worked wonderfully. However, now my insurance company won't pay for it. Always one step forward, two steps back."""
ritalin,For ADHD,"For ADHD""Diagnosed in 1992 with ADHD & prescribed Ritalin. Before I took Ritalin, I was forgetful, daydreamed, moody, couldn't focus for long, did soft drugs, drank alcohol, smoked cigarettes, and was negative-minded. Now, I do none of the above. It makes me feel motivated to go to work every day, and I read novels from page 1 to the last page. Before, I never had the patience to read past page 1. My doctor prescribes me 60 mg per day. To start my day, I take 1 SR 20 mg with 1 10 mg; then 4 hours later, I take 1 10 mg; then 4 hours later, I take 1 SR 20 mg. The problem is, after the first 8 hours, I know I need a 10 mg for the next 4 hours. But my doctor won't prescribe me over 60 mg per day because he thinks that is the maximum allowed per day. Any suggestions?"""
ritalin,For ADHD,"For ADHD""My doctor originally put me on Ritalin, and I stayed on it for 2 months. It made me very sick to my stomach, although it did improve my concentration. I have since switched to another medication and am doing much better."""
ritalin,For ADHD,"For ADHD""I've been taking it for 7 years, and it turned my life around. I am severely dyslexic and have ADD and am on 30 mg to 40 mg a day. However, as of recent, it has started making me slightly disoriented and even slightly sleepy, and my thoughts come faster than I speak (used to happen before I started taking Ritalin with my dyslexia), but it feels worse. I just started interning at an ad company, so not the best of times!"""
ritalin,For ADHD,"For ADHD""Been on and off Ritalin for years. The regular version works well for me, but its effect was gone in under 3 hours. The extended release was useless - I metabolize it too quickly and was overdosing on it after about an hour. When I was working, it was great not wasting time getting distracted by crap: no retracing my steps to remember what I was looking for; no wondering why I had the telephone in my hand - was I calling or answering, etc.? But I didn't like driving under Ritalin - I was used to having my attention all over the place and being able to see EVERYTHING that was going on around me: traffic slowing 5 blocks up; a wingnut weaving through lanes 2 blocks behind. I only took it while working or when I needed to focus. Same thing now."""
ritalin,For Narcolepsy,"For Narcolepsy""Recently diagnosed with narcolepsy and was given Provigil. That did nothing. Given Ritalin and this is doing nothing either. Started at 10 mg twice a day. Increased to 30 mg twice a day. This is nothing more than a decent cup of coffee. Lasts no longer than an hour. Need better help for my tiredness."""
ritalin,For Narcolepsy,"For Narcolepsy""I started on Ritalin for narcolepsy at 10 mg twice a day. Did not keep me awake. Went to 20 mg twice a day, still didn't work well. 30 mg twice a day is working well. I feel so much better, and I'm more active than I have been in years."""
ritalin,For ADHD,"For ADHD""I can't string words together in a sentence anymore, I am devoid of any personality, and the worst part is that there is no pay off just the physical symptoms of feeling like I want to jump out of my skin and I am being anti-social as a result of it."""
ritalin,For ADHD,"For ADHD""Made me feel so horrible even at its lowest dose. Didn't help just made everything weird and then when it starts wearing off, depressive and anxious. I have all symptoms of ADD but I have anxiety under control through diet & exercise, and I've never struggled with depression, but Ritalin literally made me ADD PLUS anxiety and depression. No thanks."""
ritalin,For ADHD,"For ADHD""I am a 28-year-old female. I have been taking 20 mg of Ritalin per day for 8 weeks, first short-acting, then tried the long-acting. By far, the short-acting helped my concentration in school, work, and my social life. When I switched to the extended release, it felt like it wasn't doing jack, even though I was taking the same dose. The only thing I don't like about the short-acting was the loss of appetite. So annoying. But I'm about to start back with the short-acting and with 40 mg per day. I can't wait to have my concentration back!"""
ritalin,For ADHD,"For ADHD""After trying Dexedrine and having a few unpleasant side effects, my doctor had me try Ritalin. I was on it for about 2 weeks before I decided I wasn't going to take it anymore. Severe depression, increased anxiety, and worsened general ADHD symptoms were the norm on this drug for me."""
ritalin,For ADHD,"For ADHD""Helped me a lot. Been using it for 8 months, and now I'm on a 20 mg, 2 times a day. I never had the power to just sit still and stay on one task. Now I'm able to actually sit down and focus on one task. I'm 16 and was diagnosed at 15. Ritalin doesn't last long enough, though, which is the only downside. Only lasts for 3 hours, but it's good because you could get your appetite back. No side effects, just a little nervous at times and headaches, which are rare. Also, suppressed appetite the first hour you take it."""
ritalin,For ADHD,"For ADHD""Side effect for women. I took this for 8 months and bled every day. I was in my mid-20s and did not realize it was this pill. Even one pill of the lowest amount will cause me to spot. This is a rare condition of 0.07%. The bleeding was horrible and constant. I spent hundreds of dollars getting tested on my female body to see the cause. Once I realized it was the meds, I stopped. Scariest time of my life!!! Be warned, ladies. This could happen to you."""
ritalin,For ADHD,"For ADHD""My son was diagnosed with ADHD last week. He has always been super hyper, climbs on furniture, spins, sticks his tongue out, and can't look anyone in the eyes without fidgeting around. I didn't want to believe it, but when my parents and my grandparents, also the dentist, asked about him, I knew things were getting worse. He was seen by three specialists in NH and was given 5 mg of Ritalin, 1/2 morning, 1/2 afternoon. He has already had a profound change in his behavior. He doesn't stick his tongue out of his mouth at all and makes crazy noises. He can sit calmly now and concentrate, he actually played with some of his toys, which he didn't really do before. Only con so far: after 4 hours, he has aggressive behavior and cries over nothing. Just started, maybe that's why."""
ritalin,For ADHD,"For ADHD""My 8-year-old daughter is on Ritalin at the moment. We find she is getting migraine headaches, she has lost 3 kg due to lack of appetite, and she is very emotional coming off it, and she doesn't sleep much. On the other side of things, she has shown a large improvement at school with her concentration going from the bottom of the class to the top of the class in just 3 months."""
ritalin,For ADHD,"For ADHD""30-year-old male. Recently diagnosed with ADHD. Been taking 10 mg three times a day. 8 a.m. (with breakfast), 12 p.m. (with lunch), 4 p.m. (with snack). I realized after a week that I cannot mix it with coffee, if I do, it makes me feel very anxious and 'jittery.' However, I don't find the side effects that bad at all without coffee. I do want to keep playing with the doses to tweak it, but off to a good start. Glad I realized it was the coffee making me feel like rubbish before I gave up on the drug."""
ritalin,For ADHD,"For ADHD""I used Ritalin when I was in 1st grade. Until I was in 6th grade, these tablets helped me a lot with ADHD. But I outgrew the hyperactivity. The reason I rated it a 9/10 was because in 6th grade the medicine was working well, but I was on 200 mg of it, so the doctor had to take me off of it fast. Then I had a Ritalin crash in an overnight hospital. But other than that, it is a great drug for treating ADHD. It helped me pay attention and not jump off my mom's dresser (the dresser story is true about me)."""
ritalin,For Narcolepsy,"For Narcolepsy""This medicine is doing its job. I actually fell asleep standing up in my dining room. Hit my chin on the table (ouch). Now, I don't fall asleep at inappropriate times (after I take my first dose). I do have concerns about its habitual possibilities, which I must say, my doctor did not warn me about. I will have to keep a close watch on my behavior I guess, but it is working."""
ritalin,For ADHD,"For ADHD""I’ve been on Ritalin for almost a year now, and it hasn’t been great, but at the same time it hasn’t been bad. It helps me study and focus, but once it wears off, it leaves you feeling like you were a zombie the whole day. All in all, it’s okay, but it does have some side effects you should be aware of."""
ritalin,For Depression,"For Depression""I have had Treatment-resistant depression (TRD) for 8 years now and tried multiple medications to help. I was prescribed 5 mg to be taken six times a day of Ritalin and it has turned my life around. Within an hour it was working and the effects are still profound almost two years later.  I pair it with Magnesium on days it doesn't hit as well and I'm back to new.  Should be prescribed for more serious depressives.  Just look at the reviews here for it.  Zero withdrawals ever."""
ritalin,For ADHD,"For ADHD""This medicine made me feel zombie-like. I had hopes of focus and alertness, and I know achieving the level of focus intended for the medicine does take a couple of weeks to take effect. But I do not think I can tolerate the restlessness feeling to achieve the intended effect. Just my opinion."""
ritalin,For ADHD,"For ADHD""I wanted to update about my medication. I am now 20 mg of Ritalin twice daily and 50 mg of Zoloft generic once daily. Having suffered bipolar depression, PTSD, ADD/ADHD throughout different periods in my life. I also have Borderline/Mild General Learning Disability, a labeling in terms that is least offensive to Mild Mental Retardation or Borderline/Mild Intellectual Disability. In my case, the GLD is extremely least severe in the slightest degree. Ritalin actually works very well for me, while Zoloft treats the anxiety, depression, and some mild obsessive-compulsive behavioral thoughts, but nothing extreme, severe, or serious. In some people, depending on DNA and how generics affect medication, the effects might be very different, etc."""
ritalin,For ADHD,"For ADHD""I felt very groggy and out of it for a while on this drug. I felt like I could barely form a thought and had great difficulty interacting with people while on it. I had no feelings, no emotions, it felt like if I had to choose an emotion, it would be disoriented."""
ritalin,For ADHD,"For ADHD""I was first given Ritalin at 6 years old. Ritalin made it hard for me to sleep. Being on Ritalin made me feel nauseous.  Ritalin caused tremors in my arms. Being forced to take Ritalin made me self-conscious. Ritalin increased my anxiety. My anxiety turned into panic attacks so I was prescribed with antidepressants like Zoloft, Wellbutrin and Effexor. I was also prescribed with Lamictal, an anti-convulsant. For me, Ritalin was the ""gateway drug."""""
ritalin,For Narcolepsy,"For Narcolepsy""Let me start by stating that I am a 24-year-old female with a history of idiopathic hypersomnia, coarctation of the aorta, and patent ductus arteriosus (PDA). I was recently in a car accident and received my second concussion. Upon visiting my neurologist for headaches/migraine complaints, I brought to his attention my debilitating fatigue I've experienced since the last concussion. I've been to multiple doctors, and they pushed aside this symptom. I was almost in tears when my neurologist prescribed Ritalin. Day 3: improved concentration and more energy! So far, so good. I was worried I would have problems because of my heart conditions, but it is anatomic and not rhythmic, so I'm okay! He also assured me this will help with weight loss, which is great! Hope to continue to see great results with this medication."""
ritalin,For Narcolepsy,"For Narcolepsy""Taken Ritalin over 15 years for narcolepsy. Provigil to $$. Over the years, I have increased to 40 mg two times daily. Have not (and won't) increased dosage in over 5 years. Retired now, so it's easier to adjust mg. If I feel it's not working, I will stop taking it for a week or two (if possible) and then go back 10 mg at a time. May be time-consuming but never had addiction. Considering the SR."""
ritalin,For Narcolepsy,"For Narcolepsy""I had to quit Ritalin, despite starting on a very small dose, because it gave me tremors and a 'wired' (but not alert) feeling. The problems did not diminish within 2 weeks, and that was all I could stand."""
ritalin,For ADHD,"For ADHD""I am a 20-year-old woman, 145 pounds, and have been diagnosed with ADD since I was 8. I had tried numerous medications to try and help over the last 12 years, but it always seemed the side effects outweighed the good it was doing. I wouldn’t eat and felt depressed/zombie-like on other medications. I take Ritalin 10 mg twice daily. It usually lasts around 3-4 hours. I have to stop and tell myself to eat something sometimes, and my heart rate becomes faster, but other than that, those are my only side effects. I feel great at the end of the day and am very productive during those hours. Ritalin is the first one that works for me, and the side effects don’t outweigh the good it’s doing for me."""
ritalin,For ADHD,"For ADHD""I went to the Doctor for depression and she told me to my face that it isn't depression. She recommend me to go to another Doctor to get evaluated for ADHD. So I went to the new Doctor and she noticed how I couldn't stay on one topic, and how I was constant playing with my fingers, and when the Doctor was talking to me I got really bored and started to look around. She stated that I had ""Severe"" ADHD, she asked me if I feel comfortable with taking Ritalin. Of course I said let's give it a shot. 
The first day I took it, it was amazing. All this talking inside my head, my feelings, my thoughts went away. I felt normal. After 2 weeks later I started going back to my old ways, where Ritalin wasn't helping me whatsoever. The Doctor then increased the dosage, and ever since that last increased, I can it has helped me A LOT! I am in college right now, and I am doing so much better with my grades and studying. I am so glad that this was recommended to me."""
ritalin,For ADHD,"For ADHD""Just got diagnosed ADHD and prescribed Ritalin (10mg 3 times a day, starting with 1 and increasing it every few days). It’s my 6th day taking it and it feels like it’s doing the complete opposite of what it should be doing. It’s worsened my anxiety and depression, I feel robotic and numb, my moods fluctuate more than usual, I can’t focus, I feel tired and lethargic, irritable, nauseous, dizzy, racing heart, and none of my usual coping mechanisms that I had before I started meds are helping at all. It’s helped so little and made me feel so much worse. I've started dreading having to take them. Called my Dr today and waiting for him to call back so I can speak to him about it."""
ritalin,For ADHD,"For ADHD""After dropping out of college for the third time at 23, I felt like a failure. I went to seek a second opinion and got diagnosed with ADHD. I was prescribed 10mg of Ritalin. It made me mentally present and focused. However, I noticed a crash at 2 pm. So the doctor told me to take 5mg twice, once in the morning and the afternoon. Each pill lasts for 4 hours. If I need to be working for more than 8 hours, I need to add another 5mg. Overall, this medication really helps my ADHD. I'm optimistic about what life has in store for me. I want to work on relationships, education, and financial state which I really struggled with due to attention issues."""
ritalin,For Narcolepsy,"For Narcolepsy""I was diagnosed with excessive daytime sleepiness in the '90s. I took Ritalin twice a day for more than a decade. I found it was like being on a roller coaster. My first dose was mid-morning, and it would take at least 30 minutes before it started kicking in. It 'peaked' about 2 hours after consuming the dose, where I felt awake, alert, and full of energy for a very short time. Then its effects slowly wore off, leaving me feeling completely out of it, depressed, slow, and unmotivated. I took the 2nd dose mid-afternoon, and its effectiveness ran the same course. It was a struggle getting through every day."""
ritalin,For ADHD,"For ADHD""I found Ritalin increased my alertness and concentration. I rate Ritalin 2/10 as I find it increased my depression, from which point I stopped taking it. Unsure whether the Ritalin interacted negatively with my usual small dose antidepressant Cymbalta or if increased depression is an unreported side effect."""
